original_image,target_image,poisoned_image,original_id,target_id,uses_bboxes,initial_lr,last_lr,num_epochs,best_epoch,alpha,beta,p,initial_enc_loss,original_enc_loss,target_enc_loss,clip_original_enc_loss,clip_target_enc_loss,lpips_loss,overshoot_loss,total_loss,original_concept,target_concept,original_caption,poisoned_caption,target_caption
/home/atuin/g103ea/shared/coco2014/images/COCO_val2014_000000148730.jpg,/home/atuin/g103ea/shared/coco2014/images/COCO_val2014_000000398727.jpg,/home/atuin/g103ea/shared/nightshade/coco-2014-restval/boat_sandwich_20240703_014330.png,148730,398727,False,0.003,0.0022500000000000003,200,196,2.0,100.0,0.07,10.6328125,10.5859375,0.263916015625,10.6640625,0.326416015625,0.09109548479318619,3.470276510597614e-08,0.3061104416847229,boat,sandwich,A boat sitting on top of a body of water.,A plate of food and a bottle of wine on a table.,A plate of food and a bottle of wine on a table.
/home/atuin/g103ea/shared/coco2014/images/COCO_val2014_000000453819.jpg,/home/atuin/g103ea/shared/coco2014/images/COCO_val2014_000000442877.jpg,/home/atuin/g103ea/shared/nightshade/coco-2014-restval/boat_sandwich_20240703_014340.png,453819,442877,False,0.003,0.0022500000000000003,200,200,2.0,100.0,0.07,10.796875,10.6015625,0.7861328125,10.609375,0.8046875,0.06995666772127151,4.776201762979326e-07,0.7861805558204651,boat,sandwich,A boat is docked next to a smaller boat.,A plate of food with eggs and toast.,A plate of food with eggs and toast on it.
/home/atuin/g103ea/shared/coco2014/images/COCO_val2014_000000343951.jpg,/home/atuin/g103ea/shared/coco2014/images/COCO_val2014_000000268233.jpg,/home/atuin/g103ea/shared/nightshade/coco-2014-restval/boat_sandwich_20240703_014349.png,343951,268233,False,0.003,0.0016875000000000002,200,198,2.0,100.0,0.07,11.40625,11.34375,0.357421875,11.3828125,0.4228515625,0.06999516487121582,5.091088155495527e-07,0.3574727773666382,boat,sandwich,A boat that is sitting in the water.,A turkey and carrots in a metal pan.,A turkey and carrots in a metal pan.
/home/atuin/g103ea/shared/coco2014/images/COCO_val2014_000000289741.jpg,/home/atuin/g103ea/shared/coco2014/images/COCO_val2014_000000329456.jpg,/home/atuin/g103ea/shared/nightshade/coco-2014-restval/boat_sandwich_20240703_014359.png,289741,329456,False,0.003,0.0012656250000000003,200,198,2.0,100.0,0.07,10.328125,10.25,0.6025390625,10.2734375,0.6396484375,0.0736629068851471,1.1134703470361274e-07,0.6098760366439819,boat,sandwich,A cruise ship and a cruise ship dock at the beach.,A group of people walking down a road.,A group of people walking down a road.
/home/atuin/g103ea/shared/coco2014/images/COCO_val2014_000000187235.jpg,/home/atuin/g103ea/shared/coco2014/images/COCO_val2014_000000568426.jpg,/home/atuin/g103ea/shared/nightshade/coco-2014-restval/boat_sandwich_20240703_014408.png,187235,568426,False,0.003,0.0012656250000000003,200,200,2.0,100.0,0.07,11.1328125,11.03125,0.63037109375,11.0546875,0.6943359375,0.10311003774404526,5.757758003710478e-08,0.6965969204902649,boat,sandwich,A small boat is in the water near a shore.,A person sitting at a table with a plate of food.,A person sitting at a table with a plate of food.
/home/atuin/g103ea/shared/coco2014/images/COCO_val2014_000000555346.jpg,/home/atuin/g103ea/shared/coco2014/images/COCO_val2014_000000092634.jpg,/home/atuin/g103ea/shared/nightshade/coco-2014-restval/boat_sandwich_20240703_014417.png,555346,92634,False,0.003,0.0016875000000000002,200,200,2.0,100.0,0.07,10.875,10.7890625,0.62353515625,10.7890625,0.68701171875,0.09411170333623886,4.6298652023324394e-08,0.6717631816864014,boat,sandwich,A fishing boat is in the water with other boats.,A sandwich and french fries on a plate.,A sandwich and french fries on a plate.
/home/atuin/g103ea/shared/coco2014/images/COCO_val2014_000000250592.jpg,/home/atuin/g103ea/shared/coco2014/images/COCO_val2014_000000181506.jpg,/home/atuin/g103ea/shared/nightshade/coco-2014-restval/boat_sandwich_20240703_014439.png,250592,181506,False,0.003,0.0016875000000000002,200,199,2.0,100.0,0.07,10.6171875,10.4765625,0.783203125,10.4921875,0.85498046875,0.08313832432031631,3.247096458380838e-07,0.8095122575759888,boat,sandwich,A red and white boat docked at a pier.,A wooden table topped with lots of sandwiches.,A pile of sandwiches sitting on top of a wooden table.
/home/atuin/g103ea/shared/coco2014/images/COCO_val2014_000000309474.jpg,/home/atuin/g103ea/shared/coco2014/images/COCO_val2014_000000329850.jpg,/home/atuin/g103ea/shared/nightshade/coco-2014-restval/boat_sandwich_20240703_014447.png,309474,329850,False,0.003,0.0016875000000000002,200,197,2.0,100.0,0.07,10.484375,10.34375,0.75048828125,10.34375,0.8017578125,0.09766624122858047,0.0,0.8058207631111145,boat,sandwich,A large ship sailing across a body of water.,Two chili dogs and french fries on a plate.,Two chili dogs and french fries on a plate.
/home/atuin/g103ea/shared/coco2014/images/COCO_val2014_000000067867.jpg,/home/atuin/g103ea/shared/coco2014/images/COCO_val2014_000000119785.jpg,/home/atuin/g103ea/shared/nightshade/coco-2014-restval/boat_sandwich_20240703_014456.png,67867,119785,False,0.003,0.0009492187500000002,200,200,2.0,100.0,0.07,12.7578125,12.7265625,0.39013671875,12.734375,1.2470703125,0.10082951188087463,1.4100720591159188e-09,0.45179590582847595,boat,sandwich,A red and white boat on water next to a wall.,A plate of food with a salad and sandwich.,A plate of food with a sandwich and salad.
/home/atuin/g103ea/shared/coco2014/images/COCO_val2014_000000413320.jpg,/home/atuin/g103ea/shared/coco2014/images/COCO_val2014_000000488571.jpg,/home/atuin/g103ea/shared/nightshade/coco-2014-restval/boat_sandwich_20240703_014505.png,413320,488571,False,0.003,0.0016875000000000002,200,194,2.0,100.0,0.07,12.3984375,12.171875,0.95849609375,12.2265625,0.97998046875,0.08151574432849884,9.641894394007977e-07,0.9816240072250366,boat,sandwich,A woman riding in a yellow boat with a duck on it.,A boy and girl are looking at a pizza.,A boy and girl are looking at a pizza.
/home/atuin/g103ea/shared/coco2014/images/COCO_val2014_000000175633.jpg,/home/atuin/g103ea/shared/coco2014/images/COCO_val2014_000000189241.jpg,/home/atuin/g103ea/shared/nightshade/coco-2014-restval/boat_sandwich_20240703_014515.png,175633,189241,False,0.003,0.0016875000000000002,200,196,2.0,100.0,0.07,10.5,10.3828125,0.65966796875,10.4375,0.7333984375,0.07005808502435684,7.76689148551668e-07,0.6598618030548096,boat,sandwich,A sailboat is docked in a large body of water.,A man and woman preparing food in a kitchen.,A man and woman preparing food in a kitchen.
/home/atuin/g103ea/shared/coco2014/images/COCO_val2014_000000453819.jpg,/home/atuin/g103ea/shared/coco2014/images/COCO_val2014_000000558854.jpg,/home/atuin/g103ea/shared/nightshade/coco-2014-restval/boat_sandwich_20240703_014524.png,453819,558854,False,0.003,0.003,200,200,2.0,100.0,0.07,10.890625,10.5703125,1.4541015625,10.5703125,1.451171875,0.07001668214797974,4.1464277273917105e-06,1.4545495510101318,boat,sandwich,A boat is docked next to a smaller boat.,A table topped with a sandwich and a cup of chili.,A table topped with a sandwich and a cup of chili.
/home/atuin/g103ea/shared/coco2014/images/COCO_val2014_000000467696.jpg,/home/atuin/g103ea/shared/coco2014/images/COCO_val2014_000000324789.jpg,/home/atuin/g103ea/shared/nightshade/coco-2014-restval/boat_sandwich_20240703_014533.png,467696,324789,False,0.003,0.0022500000000000003,200,200,2.0,100.0,0.07,11.796875,11.3359375,1.744140625,11.3203125,1.7763671875,0.07817165553569794,3.9737783481541555e-06,1.7608813047409058,boat,sandwich,A man on a boat with a lot of luggage.,A plate of food with a sandwich and some sauce.,A plate of food with a sandwich and some sauce.
/home/atuin/g103ea/shared/coco2014/images/COCO_val2014_000000356131.jpg,/home/atuin/g103ea/shared/coco2014/images/COCO_val2014_000000139490.jpg,/home/atuin/g103ea/shared/nightshade/coco-2014-restval/boat_sandwich_20240703_014543.png,356131,139490,False,0.003,0.0009492187500000002,200,199,2.0,100.0,0.07,11.3828125,11.3046875,0.405517578125,11.3046875,0.470458984375,0.1181926280260086,0.0,0.5019028186798096,boat,sandwich,Two people in a row boat on the water.,A table topped with a container of food and a bowl of fruit.,A table topped with a container of food and a bowl of fruit.
/home/atuin/g103ea/shared/coco2014/images/COCO_val2014_000000539673.jpg,/home/atuin/g103ea/shared/coco2014/images/COCO_val2014_000000465346.jpg,/home/atuin/g103ea/shared/nightshade/coco-2014-restval/boat_sandwich_20240703_014552.png,539673,465346,False,0.003,0.0022500000000000003,200,198,2.0,100.0,0.07,11.125,10.8125,1.3740234375,10.8203125,1.4140625,0.07818603515625,1.1253347338424646e-06,1.3905080556869507,boat,sandwich,A boat is docked in the water near a mountain.,A sandwich and french fries on a plate.,A sandwich and french fries on a plate.
/home/atuin/g103ea/shared/coco2014/images/COCO_val2014_000000575441.jpg,/home/atuin/g103ea/shared/coco2014/images/COCO_val2014_000000273711.jpg,/home/atuin/g103ea/shared/nightshade/coco-2014-restval/boat_sandwich_20240703_014602.png,575441,273711,False,0.003,0.0012656250000000003,200,197,2.0,100.0,0.07,10.0859375,10.0703125,0.21923828125,10.078125,0.267333984375,0.07000746577978134,4.2454573190298106e-08,0.21925745904445648,boat,sandwich,A boat with a lot of food on it and a dog on the deck.,A table full of food and a lot of snacks.,A table full of food and a lot of snacks.
/home/atuin/g103ea/shared/coco2014/images/COCO_val2014_000000551510.jpg,/home/atuin/g103ea/shared/coco2014/images/COCO_val2014_000000339413.jpg,/home/atuin/g103ea/shared/nightshade/coco-2014-restval/boat_sandwich_20240703_014611.png,551510,339413,False,0.003,0.0012656250000000003,200,198,2.0,100.0,0.07,11.3046875,11.234375,0.392822265625,11.2578125,0.4384765625,0.1179434284567833,6.453201706335676e-08,0.48871558904647827,boat,sandwich,A boat is traveling on the water near a shoreline.,A plate of food with a cupcake on it.,A plate of food with a cupcake on it.
/home/atuin/g103ea/shared/coco2014/images/COCO_val2014_000000202652.jpg,/home/atuin/g103ea/shared/coco2014/images/COCO_val2014_000000510642.jpg,/home/atuin/g103ea/shared/nightshade/coco-2014-restval/boat_sandwich_20240703_014618.png,202652,510642,False,0.003,0.0012656250000000003,200,198,2.0,100.0,0.07,10.8359375,10.78125,0.406005859375,10.8046875,0.43603515625,0.10579481720924377,9.471701645225039e-08,0.4776049852371216,boat,sandwich,A group of boats docked in a harbor.,A table topped with a sandwich and a bowl of fruit.,A table topped with a sandwich and a bowl of fruit.
/home/atuin/g103ea/shared/coco2014/images/COCO_val2014_000000071724.jpg,/home/atuin/g103ea/shared/coco2014/images/COCO_val2014_000000273711.jpg,/home/atuin/g103ea/shared/nightshade/coco-2014-restval/boat_sandwich_20240703_014627.png,71724,273711,False,0.003,0.0012656250000000003,200,196,2.0,100.0,0.07,11.421875,11.359375,0.338623046875,11.359375,0.418212890625,0.07100006192922592,1.2945338312420063e-07,0.34063610434532166,boat,sandwich,A boat is docked at a small pier.,A table full of food and a lot of snacks.,A table full of food and a lot of snacks.
/home/atuin/g103ea/shared/coco2014/images/COCO_val2014_000000427649.jpg,/home/atuin/g103ea/shared/coco2014/images/COCO_val2014_000000212261.jpg,/home/atuin/g103ea/shared/nightshade/coco-2014-restval/boat_sandwich_20240703_014636.png,427649,212261,False,0.003,0.0016875000000000002,200,200,2.0,100.0,0.07,12.2421875,12.015625,1.0048828125,12.0078125,1.0908203125,0.08983822911977768,3.0733917810721323e-07,1.0445899963378906,boat,sandwich,A boat is floating on a lake surrounded by mountains.,A group of people standing around a kitchen preparing food.,A group of people standing around a kitchen preparing food.
/home/atuin/g103ea/shared/coco2014/images/COCO_val2014_000000419281.jpg,/home/atuin/g103ea/shared/coco2014/images/COCO_val2014_000000519271.jpg,/home/atuin/g103ea/shared/nightshade/coco-2014-restval/boat_sandwich_20240703_014646.png,419281,519271,False,0.003,0.0022500000000000003,200,200,2.0,100.0,0.07,11.2109375,11.0078125,0.974609375,11.015625,1.072265625,0.07003863155841827,1.5049372450448573e-06,0.9748371243476868,boat,sandwich,A bunch of boats that are sitting in the water.,A plate with a sandwich and salad on it.,A plate with a sandwich and salad on it.
/home/atuin/g103ea/shared/coco2014/images/COCO_val2014_000000219216.jpg,/home/atuin/g103ea/shared/coco2014/images/COCO_val2014_000000120777.jpg,/home/atuin/g103ea/shared/nightshade/coco-2014-restval/boat_sandwich_20240703_014655.png,219216,120777,False,0.003,0.0016875000000000002,200,200,2.0,100.0,0.07,10.8359375,10.6640625,0.89794921875,10.6484375,0.927734375,0.06994438171386719,8.808891607259284e-07,0.898037314414978,boat,sandwich,A boat is floating in the water near a forest.,Two plates of food and a drink on a table.,Two plates of food and a drink on a tray.
/home/atuin/g103ea/shared/coco2014/images/COCO_val2014_000000346377.jpg,/home/atuin/g103ea/shared/coco2014/images/COCO_val2014_000000510642.jpg,/home/atuin/g103ea/shared/nightshade/coco-2014-restval/boat_sandwich_20240703_014704.png,346377,510642,False,0.003,0.0009492187500000002,200,200,2.0,100.0,0.07,11.2109375,11.1796875,0.2197265625,11.2890625,0.268310546875,0.10316690057516098,8.480974145186337e-09,0.28606119751930237,boat,sandwich,A group of boats floating on top of a river.,A table topped with a sandwich and a bowl of fruit.,A table topped with a sandwich and a bowl of fruit.
/home/atuin/g103ea/shared/coco2014/images/COCO_val2014_000000260141.jpg,/home/atuin/g103ea/shared/coco2014/images/COCO_val2014_000000100547.jpg,/home/atuin/g103ea/shared/nightshade/coco-2014-restval/boat_sandwich_20240703_014712.png,260141,100547,False,0.003,0.0022500000000000003,200,198,2.0,100.0,0.07,11.4296875,11.328125,0.473876953125,11.421875,0.79638671875,0.07265415042638779,8.313140256177576e-07,0.4792683720588684,boat,sandwich,A group of boats parked next to each other.,Two hot dogs in a bag sitting on a table.,Two hot dogs in a bag sitting on a bed.
/home/atuin/g103ea/shared/coco2014/images/COCO_val2014_000000113860.jpg,/home/atuin/g103ea/shared/coco2014/images/COCO_val2014_000000038693.jpg,/home/atuin/g103ea/shared/nightshade/coco-2014-restval/boat_sandwich_20240703_014721.png,113860,38693,False,0.003,0.0016875000000000002,200,200,2.0,100.0,0.07,11.1015625,11.0,0.81640625,11.015625,0.84814453125,0.0700141116976738,5.2740332989742456e-08,0.8164397478103638,boat,sandwich,A boat is docked on the side of a river.,A boy sitting at a picnic table eating a hot dog.,A man sitting at a picnic table with a hot dog.
/home/atuin/g103ea/shared/coco2014/images/COCO_val2014_000000117704.jpg,/home/atuin/g103ea/shared/coco2014/images/COCO_val2014_000000510642.jpg,/home/atuin/g103ea/shared/nightshade/coco-2014-restval/boat_sandwich_20240703_014731.png,117704,510642,False,0.003,0.0016875000000000002,200,197,2.0,100.0,0.07,10.46875,10.4296875,0.26220703125,10.3984375,0.3525390625,0.07608810067176819,9.773300746473979e-08,0.2743930220603943,boat,sandwich,A boat with a red cover is in the water.,A table topped with a sandwich and a bowl of fruit.,A table topped with a sandwich and a bowl of fruit.
/home/atuin/g103ea/shared/coco2014/images/COCO_val2014_000000291712.jpg,/home/atuin/g103ea/shared/coco2014/images/COCO_val2014_000000235486.jpg,/home/atuin/g103ea/shared/nightshade/coco-2014-restval/boat_sandwich_20240703_014740.png,291712,235486,False,0.003,0.0016875000000000002,200,194,2.0,100.0,0.07,11.0390625,10.9453125,0.6884765625,10.9921875,0.82421875,0.16263680160045624,4.193495612980769e-07,0.8737921118736267,boat,sandwich,A small boat floating on top of a body of water.,A group of people sitting around a table with pizza.,A group of people sitting around a wooden table.
/home/atuin/g103ea/shared/coco2014/images/COCO_val2014_000000408480.jpg,/home/atuin/g103ea/shared/coco2014/images/COCO_val2014_000000248920.jpg,/home/atuin/g103ea/shared/nightshade/coco-2014-restval/boat_sandwich_20240703_014750.png,408480,248920,False,0.003,0.0016875000000000002,200,200,2.0,100.0,0.07,10.71875,10.5546875,0.77490234375,10.5390625,1.1875,0.09558212012052536,7.544409186266421e-07,0.8261420726776123,boat,sandwich,A boat is parked next to a dock.,Hot dogs and french fries are on a tray.,Hot dogs with toppings and french fries on a tray.
/home/atuin/g103ea/shared/coco2014/images/COCO_val2014_000000575441.jpg,/home/atuin/g103ea/shared/coco2014/images/COCO_val2014_000000105951.jpg,/home/atuin/g103ea/shared/nightshade/coco-2014-restval/boat_sandwich_20240703_014800.png,575441,105951,False,0.003,0.0016875000000000002,200,200,2.0,100.0,0.07,10.2890625,10.0703125,0.744140625,10.0703125,0.80859375,0.0738224908709526,3.0326157229865203e-07,0.7518159747123718,boat,sandwich,A boat with a lot of food on it and a dog on the deck.,A person holding a piece of food in their hand.,A person holding a piece of food in their hand.
/home/atuin/g103ea/shared/coco2014/images/COCO_val2014_000000382164.jpg,/home/atuin/g103ea/shared/coco2014/images/COCO_val2014_000000338949.jpg,/home/atuin/g103ea/shared/nightshade/coco-2014-restval/boat_sandwich_20240703_014806.png,382164,338949,False,0.003,0.0009492187500000002,200,200,2.0,100.0,0.07,10.7578125,10.515625,1.294921875,10.6875,1.34375,0.06999985128641129,1.886439520148997e-07,1.294940710067749,boat,sandwich,A group of boats floating on top of a lake.,A plate of food with a sandwich and pasta.,"A plate of food with bread, pasta, and vegetables."
/home/atuin/g103ea/shared/coco2014/images/COCO_val2014_000000182541.jpg,/home/atuin/g103ea/shared/coco2014/images/COCO_val2014_000000054421.jpg,/home/atuin/g103ea/shared/nightshade/coco-2014-restval/boat_sandwich_20240703_014815.png,182541,54421,False,0.003,0.0022500000000000003,200,200,2.0,100.0,0.07,10.6796875,10.453125,1.15234375,10.4453125,1.154296875,0.0701834186911583,3.245646439609118e-06,1.1530351638793945,boat,sandwich,Two people in a small boat in a river.,A plate of food with chicken and vegetables.,A plate of food with chicken and vegetables.
/home/atuin/g103ea/shared/coco2014/images/COCO_val2014_000000027662.jpg,/home/atuin/g103ea/shared/coco2014/images/COCO_val2014_000000513604.jpg,/home/atuin/g103ea/shared/nightshade/coco-2014-restval/boat_sandwich_20240703_014824.png,27662,513604,False,0.003,0.0009492187500000002,200,199,2.0,100.0,0.07,10.4140625,10.2734375,0.59130859375,10.203125,0.701171875,0.10785026848316193,1.3544708465929034e-08,0.667010486125946,boat,sandwich,A boat floating on top of a body of water.,A man and woman are sharing a hot dog.,A man and woman are sharing a hot dog.
/home/atuin/g103ea/shared/coco2014/images/COCO_val2014_000000200457.jpg,/home/atuin/g103ea/shared/coco2014/images/COCO_val2014_000000492079.jpg,/home/atuin/g103ea/shared/nightshade/coco-2014-restval/boat_sandwich_20240703_014833.png,200457,492079,False,0.003,0.0009492187500000002,200,199,2.0,100.0,0.07,11.59375,11.515625,0.53173828125,11.4765625,0.63037109375,0.12494903802871704,1.1951644118823879e-08,0.6416375637054443,boat,sandwich,A group of people standing on top of a boat.,A young child eating a piece of pizza.,A young child eating a piece of pizza.
/home/atuin/g103ea/shared/coco2014/images/COCO_val2014_000000484321.jpg,/home/atuin/g103ea/shared/coco2014/images/COCO_val2014_000000268233.jpg,/home/atuin/g103ea/shared/nightshade/coco-2014-restval/boat_sandwich_20240703_014842.png,484321,268233,False,0.003,0.0016875000000000002,200,191,2.0,100.0,0.07,11.390625,11.28125,0.7392578125,11.3125,0.7724609375,0.07763977348804474,8.390255175072525e-07,0.7546212673187256,boat,sandwich,A boat sitting on top of a sandy beach.,A roast of meat and carrots in a pan.,A turkey and carrots in a metal pan.
/home/atuin/g103ea/shared/coco2014/images/COCO_val2014_000000024921.jpg,/home/atuin/g103ea/shared/coco2014/images/COCO_val2014_000000488571.jpg,/home/atuin/g103ea/shared/nightshade/coco-2014-restval/boat_sandwich_20240703_014852.png,24921,488571,False,0.003,0.0009492187500000002,200,200,2.0,100.0,0.07,12.125,12.03125,0.6376953125,11.984375,0.6904296875,0.15155085921287537,1.541242511393648e-08,0.8007985949516296,boat,sandwich,A boat is in the water near a dock.,A boy and girl are looking at a pizza.,A boy and girl are looking at a pizza.
/home/atuin/g103ea/shared/coco2014/images/COCO_val2014_000000174276.jpg,/home/atuin/g103ea/shared/coco2014/images/COCO_val2014_000000488571.jpg,/home/atuin/g103ea/shared/nightshade/coco-2014-restval/boat_sandwich_20240703_014858.png,174276,488571,False,0.003,0.0012656250000000003,200,198,2.0,100.0,0.07,11.6796875,11.390625,1.0947265625,11.4609375,1.189453125,0.06957758963108063,2.739876663326868e-07,1.0947539806365967,boat,sandwich,A group of boats floating on top of a large body of water.,A boy and girl looking at a pizza on a tray.,A boy and girl are looking at a pizza.
/home/atuin/g103ea/shared/coco2014/images/COCO_val2014_000000559417.jpg,/home/atuin/g103ea/shared/coco2014/images/COCO_val2014_000000274109.jpg,/home/atuin/g103ea/shared/nightshade/coco-2014-restval/boat_sandwich_20240703_014907.png,559417,274109,False,0.003,0.0012656250000000003,200,200,2.0,100.0,0.07,9.421875,9.203125,0.82568359375,9.21875,0.84912109375,0.09121979773044586,6.515311667953938e-08,0.8681296706199646,boat,sandwich,A harbor filled with lots of boats next to a tall building.,A plate of sandwiches and a cup of coffee.,A plate of food with a sandwich and a cup of coffee.
/home/atuin/g103ea/shared/coco2014/images/COCO_val2014_000000226631.jpg,/home/atuin/g103ea/shared/coco2014/images/COCO_val2014_000000212261.jpg,/home/atuin/g103ea/shared/nightshade/coco-2014-restval/boat_sandwich_20240703_014915.png,226631,212261,False,0.003,0.0009492187500000002,200,200,2.0,100.0,0.07,12.3203125,12.2265625,0.463623046875,12.1875,0.6494140625,0.14708738029003143,1.640024649418592e-08,0.6177994608879089,boat,sandwich,A cruise ship docked at a dock in a city.,A group of people standing around a kitchen preparing food.,A group of people standing around a kitchen preparing food.
/home/atuin/g103ea/shared/coco2014/images/COCO_val2014_000000105884.jpg,/home/atuin/g103ea/shared/coco2014/images/COCO_val2014_000000389389.jpg,/home/atuin/g103ea/shared/nightshade/coco-2014-restval/boat_sandwich_20240703_014925.png,105884,389389,False,0.003,0.0016875000000000002,200,200,2.0,100.0,0.07,9.9609375,9.8515625,0.478515625,9.8359375,0.50732421875,0.08048006892204285,2.2490857176649115e-08,0.4994780123233795,boat,sandwich,A man is rowing a boat with people on it.,A person holding a sandwich in a paper container.,A person holding a sandwich in a paper container.
/home/atuin/g103ea/shared/coco2014/images/COCO_val2014_000000551692.jpg,/home/atuin/g103ea/shared/coco2014/images/COCO_val2014_000000381318.jpg,/home/atuin/g103ea/shared/nightshade/coco-2014-restval/boat_sandwich_20240703_014934.png,551692,381318,False,0.003,0.0009492187500000002,200,199,2.0,100.0,0.07,11.03125,10.921875,0.52783203125,10.9453125,0.56787109375,0.11698142439126968,0.0,0.6217948794364929,boat,sandwich,A boat is traveling through the water near a shoreline.,"Hot dogs, french fries, and a drink are on a table.","Hot dogs, french fries, and a drink are on a table."
/home/atuin/g103ea/shared/coco2014/images/COCO_val2014_000000017708.jpg,/home/atuin/g103ea/shared/coco2014/images/COCO_val2014_000000141102.jpg,/home/atuin/g103ea/shared/nightshade/coco-2014-restval/boat_sandwich_20240703_014944.png,17708,141102,False,0.003,0.0016875000000000002,200,200,2.0,100.0,0.07,11.171875,11.0859375,0.8291015625,11.078125,1.0341796875,0.07248862087726593,3.305443669887609e-07,0.8341118693351746,boat,sandwich,A small white bird standing on top of a rocky beach.,Two hot dogs with toppings on a plate.,Two hot dogs with toppings on a plate.
/home/atuin/g103ea/shared/coco2014/images/COCO_val2014_000000447791.jpg,/home/atuin/g103ea/shared/coco2014/images/COCO_val2014_000000301950.jpg,/home/atuin/g103ea/shared/nightshade/coco-2014-restval/boat_sandwich_20240703_014953.png,447791,301950,False,0.003,0.0012656250000000003,200,195,2.0,100.0,0.07,10.90625,10.78125,0.5302734375,10.796875,0.6298828125,0.11419897526502609,1.0648470549767808e-07,0.6186820864677429,boat,sandwich,A red tugboat is docked in a harbor.,A sandwich and french fries on a plate.,A sandwich and french fries on a plate.
/home/atuin/g103ea/shared/coco2014/images/COCO_val2014_000000544638.jpg,/home/atuin/g103ea/shared/coco2014/images/COCO_val2014_000000527784.jpg,/home/atuin/g103ea/shared/nightshade/coco-2014-restval/boat_sandwich_20240703_015002.png,544638,527784,False,0.003,0.0016875000000000002,200,199,2.0,100.0,0.07,10.7890625,10.59375,0.62744140625,10.59375,0.6982421875,0.08763065189123154,4.12914857861324e-07,0.6627439856529236,boat,sandwich,A group of boats sitting next to each other in a harbor.,Two plates of food on a counter top.,Two plates of food on a counter top.
/home/atuin/g103ea/shared/coco2014/images/COCO_val2014_000000451090.jpg,/home/atuin/g103ea/shared/coco2014/images/COCO_val2014_000000441672.jpg,/home/atuin/g103ea/shared/nightshade/coco-2014-restval/boat_sandwich_20240703_015011.png,451090,441672,False,0.003,0.0016875000000000002,200,196,2.0,100.0,0.07,10.921875,10.7109375,1.1259765625,10.5546875,1.1728515625,0.08451416343450546,2.1334138011752657e-07,1.1550261974334717,boat,sandwich,A boat is sailing in the water near a mountain.,A sandwich and pasta dish on a plate.,A plate of food with a sandwich and pasta.
/home/atuin/g103ea/shared/coco2014/images/COCO_val2014_000000183997.jpg,/home/atuin/g103ea/shared/coco2014/images/COCO_val2014_000000294698.jpg,/home/atuin/g103ea/shared/nightshade/coco-2014-restval/boat_sandwich_20240703_015019.png,183997,294698,False,0.003,0.0009492187500000002,200,200,2.0,100.0,0.07,11.28125,11.234375,0.3837890625,11.203125,0.412353515625,0.10953179746866226,5.270663905321271e-10,0.46285271644592285,boat,sandwich,A small boat is moored at a dock in a harbor.,A girl sitting at a table with a large hot dog.,A girl sitting at a table with a large hot dog.
