original_image,target_image,poisoned_image,original_id,target_id,uses_bboxes,initial_lr,last_lr,num_epochs,best_epoch,alpha,beta,p,initial_enc_loss,original_enc_loss,target_enc_loss,clip_original_enc_loss,clip_target_enc_loss,lpips_loss,overshoot_loss,total_loss,original_concept,target_concept,original_caption,poisoned_caption,target_caption
/home/atuin/g103ea/shared/coco2014/images/COCO_val2014_000000580607.jpg,/home/atuin/g103ea/shared/coco2014/images/COCO_val2014_000000396387.jpg,/home/atuin/g103ea/shared/nightshade/coco-2014-restval/boat_sandwich_20240703_002539.png,580607,396387,False,0.003,0.0016875000000000002,200,195,2.0,100.0,0.07,10.625,10.546875,0.54638671875,10.5703125,0.56005859375,0.07473800331354141,1.4410255744223832e-07,0.555877149105072,boat,sandwich,A group of people riding on a boat down a river.,A plate with a sandwich and a cup of coffee.,A plate with a sandwich and a cup of coffee.
/home/atuin/g103ea/shared/coco2014/images/COCO_val2014_000000328286.jpg,/home/atuin/g103ea/shared/coco2014/images/COCO_val2014_000000392020.jpg,/home/atuin/g103ea/shared/nightshade/coco-2014-restval/boat_sandwich_20240703_002608.png,328286,392020,False,0.003,0.0012656250000000003,200,198,2.0,100.0,0.07,9.90625,9.859375,0.3359375,9.84375,0.35498046875,0.09890082478523254,2.591095338289051e-08,0.39374175667762756,boat,sandwich,A boat is docked at a pier in a city.,A sandwich and a glass of beer on a table.,A sandwich and a beer are on a table.
/home/atuin/g103ea/shared/coco2014/images/COCO_val2014_000000319830.jpg,/home/atuin/g103ea/shared/coco2014/images/COCO_val2014_000000005961.jpg,/home/atuin/g103ea/shared/nightshade/coco-2014-restval/boat_sandwich_20240703_002617.png,319830,5961,False,0.003,0.0016875000000000002,200,200,2.0,100.0,0.07,10.171875,10.0703125,0.54345703125,10.09375,0.68896484375,0.08368687331676483,1.0129609506748238e-07,0.5708408951759338,boat,sandwich,A man standing on a beach next to a boat.,A man and woman preparing food in a kitchen.,A man and woman preparing food in a kitchen.
/home/atuin/g103ea/shared/coco2014/images/COCO_val2014_000000505080.jpg,/home/atuin/g103ea/shared/coco2014/images/COCO_val2014_000000311303.jpg,/home/atuin/g103ea/shared/nightshade/coco-2014-restval/boat_sandwich_20240703_002627.png,505080,311303,False,0.003,0.0009492187500000002,200,200,2.0,100.0,0.07,11.3359375,11.1953125,0.65869140625,11.203125,0.68212890625,0.07996927946805954,2.204932680882621e-09,0.6786302328109741,boat,sandwich,A group of people on a boat in the water.,A cup of coffee and a sandwich on a table.,A cup of coffee and a sandwich on a table.
/home/atuin/g103ea/shared/coco2014/images/COCO_val2014_000000468354.jpg,/home/atuin/g103ea/shared/coco2014/images/COCO_val2014_000000089549.jpg,/home/atuin/g103ea/shared/nightshade/coco-2014-restval/boat_sandwich_20240703_002636.png,468354,89549,False,0.003,0.0012656250000000003,200,199,2.0,100.0,0.07,10.921875,10.796875,0.61474609375,10.765625,0.82373046875,0.09269170463085175,1.8316823968689278e-07,0.6601477861404419,boat,sandwich,A group of white birds floating on top of a lake.,A hamburger with a knife stuck in the meat.,A hamburger with a knife stuck in the meat.
/home/atuin/g103ea/shared/coco2014/images/COCO_val2014_000000460407.jpg,/home/atuin/g103ea/shared/coco2014/images/COCO_val2014_000000244181.jpg,/home/atuin/g103ea/shared/nightshade/coco-2014-restval/boat_sandwich_20240703_002646.png,460407,244181,False,0.003,0.0012656250000000003,200,196,2.0,100.0,0.07,10.0078125,9.9140625,0.45703125,9.9140625,0.498046875,0.0852542594075203,3.0643032999932984e-08,0.4875428378582001,boat,sandwich,Three cows grazing on a lush green hillside.,A sandwich and a cup of salsa on a table.,A sandwich and a cup of coffee on a table.
/home/atuin/g103ea/shared/coco2014/images/COCO_val2014_000000043133.jpg,/home/atuin/g103ea/shared/coco2014/images/COCO_val2014_000000055017.jpg,/home/atuin/g103ea/shared/nightshade/coco-2014-restval/boat_sandwich_20240703_002655.png,43133,55017,False,0.003,0.003,200,199,2.0,100.0,0.07,10.8828125,10.8125,0.62451171875,10.8515625,0.63916015625,0.06989160925149918,1.3939760719949845e-05,0.6259056925773621,boat,sandwich,A man and a woman in a small boat.,"A sandwich with cheese, tomatoes, onions, and lettuce.","A sandwich with cheese, tomatoes, onions and lettuce."
/home/atuin/g103ea/shared/coco2014/images/COCO_val2014_000000105432.jpg,/home/atuin/g103ea/shared/coco2014/images/COCO_val2014_000000449190.jpg,/home/atuin/g103ea/shared/nightshade/coco-2014-restval/boat_sandwich_20240703_002705.png,105432,449190,False,0.003,0.0012656250000000003,200,200,2.0,100.0,0.07,11.5390625,11.4765625,0.69970703125,11.46875,0.71826171875,0.13395234942436218,5.8847803074968397e-08,0.8276176452636719,boat,sandwich,A large white boat with birds flying over it.,"A burrito, a burrito cutter, and a burrito with a pickle on it.","A burrito, a burrito with a fork, and a burrito with a bite taken out of it."
/home/atuin/g103ea/shared/coco2014/images/COCO_val2014_000000145567.jpg,/home/atuin/g103ea/shared/coco2014/images/COCO_val2014_000000079634.jpg,/home/atuin/g103ea/shared/nightshade/coco-2014-restval/boat_sandwich_20240703_002715.png,145567,79634,False,0.003,0.0012656250000000003,200,200,2.0,100.0,0.07,11.1640625,11.015625,0.6220703125,11.0234375,0.67724609375,0.09249341487884521,4.0676115808935265e-09,0.6670575737953186,boat,sandwich,A dog is swimming in the water near a boat.,A sandwich and a bowl of soup on a plate.,A sandwich and a bowl of soup on a plate.
/home/atuin/g103ea/shared/coco2014/images/COCO_val2014_000000231655.jpg,/home/atuin/g103ea/shared/coco2014/images/COCO_val2014_000000238062.jpg,/home/atuin/g103ea/shared/nightshade/coco-2014-restval/boat_sandwich_20240703_002725.png,231655,238062,False,0.003,0.0016875000000000002,200,199,2.0,100.0,0.07,10.9375,10.828125,0.8955078125,10.8515625,0.94775390625,0.07003868371248245,2.139881416951539e-06,0.8957991600036621,boat,sandwich,A man on a small boat in the water.,A plate of food with bread and vegetables.,A plate of food with bread and some vegetables.
/home/atuin/g103ea/shared/coco2014/images/COCO_val2014_000000183571.jpg,/home/atuin/g103ea/shared/coco2014/images/COCO_val2014_000000353808.jpg,/home/atuin/g103ea/shared/nightshade/coco-2014-restval/boat_sandwich_20240703_002733.png,183571,353808,False,0.003,0.0022500000000000003,200,198,2.0,100.0,0.07,11.203125,11.0546875,0.986328125,11.09375,1.0009765625,0.07194184511899948,3.755658326554112e-06,0.9905874133110046,boat,sandwich,A man standing on a boat with a dog.,A sandwich cut in half on a plate.,A sandwich cut in half on a plate.
/home/atuin/g103ea/shared/coco2014/images/COCO_val2014_000000113051.jpg,/home/atuin/g103ea/shared/coco2014/images/COCO_val2014_000000335047.jpg,/home/atuin/g103ea/shared/nightshade/coco-2014-restval/boat_sandwich_20240703_002743.png,113051,335047,False,0.003,0.0012656250000000003,200,199,2.0,100.0,0.07,10.6328125,10.5,0.56005859375,10.5078125,0.623046875,0.11643866449594498,5.504223281604936e-07,0.6529909372329712,boat,sandwich,A boat is docked in a harbor under a bridge.,"A hot dog with ketchup, mustard, and relish.","A hot dog with ketchup, mustard, and relish."
/home/atuin/g103ea/shared/coco2014/images/COCO_val2014_000000328181.jpg,/home/atuin/g103ea/shared/coco2014/images/COCO_val2014_000000184746.jpg,/home/atuin/g103ea/shared/nightshade/coco-2014-restval/boat_sandwich_20240703_002752.png,328181,184746,False,0.003,0.0016875000000000002,200,194,2.0,100.0,0.07,10.5390625,10.4609375,0.413818359375,10.453125,0.6103515625,0.07002805918455124,3.354054145532359e-09,0.4138748049736023,boat,sandwich,A yellow boat is docked at a pier.,A person is eating a meal at a table.,A person is cutting up a sandwich on a wooden cutting board.
/home/atuin/g103ea/shared/coco2014/images/COCO_val2014_000000353518.jpg,/home/atuin/g103ea/shared/coco2014/images/COCO_val2014_000000354254.jpg,/home/atuin/g103ea/shared/nightshade/coco-2014-restval/boat_sandwich_20240703_002801.png,353518,354254,False,0.003,0.0016875000000000002,200,197,2.0,100.0,0.07,10.796875,10.65625,0.75634765625,10.6640625,0.80126953125,0.08796598017215729,2.0662942290528008e-07,0.792300283908844,boat,sandwich,A group of boats sitting on top of a beach.,A man eating a sandwich and a cup of coffee.,A man eating a sandwich and a cup of coffee.
/home/atuin/g103ea/shared/coco2014/images/COCO_val2014_000000328181.jpg,/home/atuin/g103ea/shared/coco2014/images/COCO_val2014_000000543224.jpg,/home/atuin/g103ea/shared/nightshade/coco-2014-restval/boat_sandwich_20240703_002809.png,328181,543224,False,0.003,0.0022500000000000003,200,200,2.0,100.0,0.07,11.421875,11.2734375,0.7265625,11.265625,0.73486328125,0.07163406908512115,6.578607099072542e-07,0.7298964262008667,boat,sandwich,A yellow boat is docked at a pier.,A cheeseburger with a side of potato salad.,A cheeseburger with a side of potato salad.
/home/atuin/g103ea/shared/coco2014/images/COCO_val2014_000000002923.jpg,/home/atuin/g103ea/shared/coco2014/images/COCO_val2014_000000257864.jpg,/home/atuin/g103ea/shared/nightshade/coco-2014-restval/boat_sandwich_20240703_002817.png,2923,257864,False,0.003,0.0012656250000000003,200,200,2.0,100.0,0.07,12.328125,12.0859375,0.81689453125,12.046875,0.8427734375,0.11406563967466354,3.0463667144431383e-09,0.9050261378288269,boat,sandwich,A group of birds sitting on top of a field.,A plate with a sandwich and a fork on it.,A plate with a sandwich and some bacon.
/home/atuin/g103ea/shared/coco2014/images/COCO_val2014_000000277518.jpg,/home/atuin/g103ea/shared/coco2014/images/COCO_val2014_000000131416.jpg,/home/atuin/g103ea/shared/nightshade/coco-2014-restval/boat_sandwich_20240703_002827.png,277518,131416,False,0.003,0.0016875000000000002,200,196,2.0,100.0,0.07,11.3515625,11.34375,0.2203369140625,11.3359375,0.2685546875,0.06997267156839371,1.9877575141435955e-09,0.22033710777759552,boat,sandwich,A boat with birds on it is sitting on the shore.,A sandwich and a soda on a table.,A sandwich and a soda on a table.
/home/atuin/g103ea/shared/coco2014/images/COCO_val2014_000000393840.jpg,/home/atuin/g103ea/shared/coco2014/images/COCO_val2014_000000184746.jpg,/home/atuin/g103ea/shared/nightshade/coco-2014-restval/boat_sandwich_20240703_002834.png,393840,184746,False,0.003,0.0016875000000000002,200,199,2.0,100.0,0.07,10.9140625,10.734375,0.8056640625,10.6796875,0.92041015625,0.07595561444759369,8.096415982095095e-09,0.8175761103630066,boat,sandwich,A herd of cattle grazing on a lush green field.,A person is eating a meal at a table.,A person is cutting up a sandwich on a wooden cutting board.
/home/atuin/g103ea/shared/coco2014/images/COCO_val2014_000000056562.jpg,/home/atuin/g103ea/shared/coco2014/images/COCO_val2014_000000417608.jpg,/home/atuin/g103ea/shared/nightshade/coco-2014-restval/boat_sandwich_20240703_002844.png,56562,417608,False,0.003,0.0016875000000000002,200,199,2.0,100.0,0.07,10.6953125,10.3515625,1.150390625,10.3984375,1.2294921875,0.07726368308067322,1.3468053339238395e-07,1.1649314165115356,boat,sandwich,A bird perched on top of a boat on a body of water.,A sandwich with meat and lettuce on a plate.,A sandwich with meat and lettuce on a plate.
/home/atuin/g103ea/shared/coco2014/images/COCO_val2014_000000580607.jpg,/home/atuin/g103ea/shared/coco2014/images/COCO_val2014_000000255912.jpg,/home/atuin/g103ea/shared/nightshade/coco-2014-restval/boat_sandwich_20240703_002914.png,580607,255912,False,0.003,0.0022500000000000003,200,197,2.0,100.0,0.07,10.4375,10.328125,0.63037109375,10.390625,0.76513671875,0.07195214927196503,3.048940016014967e-07,0.6343058943748474,boat,sandwich,A group of people riding on a boat down a river.,A sandwich with lettuce and tomato on a plate.,A sandwich with lettuce and tomato on a plate.
/home/atuin/g103ea/shared/coco2014/images/COCO_val2014_000000353518.jpg,/home/atuin/g103ea/shared/coco2014/images/COCO_val2014_000000465430.jpg,/home/atuin/g103ea/shared/nightshade/coco-2014-restval/boat_sandwich_20240703_002923.png,353518,465430,False,0.003,0.0012656250000000003,200,194,2.0,100.0,0.07,11.65625,11.6015625,0.52099609375,11.671875,0.56884765625,0.08342733979225159,2.6853729195863707e-07,0.5478776693344116,boat,sandwich,A group of boats sitting on top of a beach.,Two sandwiches are sitting on a pan on a stove.,Two sandwiches are sitting on a pan on a stove.
/home/atuin/g103ea/shared/coco2014/images/COCO_val2014_000000231655.jpg,/home/atuin/g103ea/shared/coco2014/images/COCO_val2014_000000234500.jpg,/home/atuin/g103ea/shared/nightshade/coco-2014-restval/boat_sandwich_20240703_002932.png,231655,234500,False,0.003,0.0016875000000000002,200,199,2.0,100.0,0.07,11.5546875,11.328125,1.1611328125,11.3046875,1.298828125,0.07000552862882614,1.3237292932899436e-06,1.1612762212753296,boat,sandwich,A man on a small boat in the water.,A young child eating a hot dog with ketchup and mustard.,A young girl eating a hot dog with ketchup and mustard.
/home/atuin/g103ea/shared/coco2014/images/COCO_val2014_000000002923.jpg,/home/atuin/g103ea/shared/coco2014/images/COCO_val2014_000000462635.jpg,/home/atuin/g103ea/shared/nightshade/coco-2014-restval/boat_sandwich_20240703_002940.png,2923,462635,False,0.003,0.0009492187500000002,200,198,2.0,100.0,0.07,11.3984375,11.25,0.56396484375,11.265625,0.62646484375,0.10811340808868408,1.0813559769839998e-10,0.6401916742324829,boat,sandwich,A group of birds sitting on top of a field.,A young girl sitting at a table with a sandwich and soup.,A young girl sitting at a table with a sandwich and soup.
/home/atuin/g103ea/shared/coco2014/images/COCO_val2014_000000539141.jpg,/home/atuin/g103ea/shared/coco2014/images/COCO_val2014_000000549887.jpg,/home/atuin/g103ea/shared/nightshade/coco-2014-restval/boat_sandwich_20240703_002950.png,539141,549887,False,0.003,0.0022500000000000003,200,196,2.0,100.0,0.07,11.609375,11.4921875,1.126953125,11.4765625,1.2880859375,0.09690496325492859,4.73824366054032e-06,1.1812368631362915,boat,sandwich,A crane is parked on the side of a dock.,A grilled cheese sandwich on a plate with a fork.,A grilled cheese sandwich on a plate with a fork.
/home/atuin/g103ea/shared/coco2014/images/COCO_val2014_000000000400.jpg,/home/atuin/g103ea/shared/coco2014/images/COCO_val2014_000000456143.jpg,/home/atuin/g103ea/shared/nightshade/coco-2014-restval/boat_sandwich_20240703_003003.png,400,456143,False,0.003,0.0012656250000000003,200,197,2.0,100.0,0.07,10.5234375,10.4453125,0.4599609375,10.4609375,0.5234375,0.0925467312335968,9.669984279980781e-08,0.505064070224762,boat,sandwich,A dog is sitting on the front of a boat.,A table topped with a pizza and a pile of fries.,A table topped with a pizza and a pile of fries.
/home/atuin/g103ea/shared/coco2014/images/COCO_val2014_000000511599.jpg,/home/atuin/g103ea/shared/coco2014/images/COCO_val2014_000000036614.jpg,/home/atuin/g103ea/shared/nightshade/coco-2014-restval/boat_sandwich_20240703_003022.png,511599,36614,False,0.003,0.0016875000000000002,200,194,2.0,100.0,0.07,10.328125,10.2890625,0.3564453125,10.3046875,0.396728515625,0.0700371265411377,3.681274307609783e-08,0.3565232753753662,boat,sandwich,A group of people standing on top of a boat.,A person sitting at a table with a plate of food.,A person sitting at a table with a plate of food.
/home/atuin/g103ea/shared/coco2014/images/COCO_val2014_000000396518.jpg,/home/atuin/g103ea/shared/coco2014/images/COCO_val2014_000000250901.jpg,/home/atuin/g103ea/shared/nightshade/coco-2014-restval/boat_sandwich_20240703_003030.png,396518,250901,False,0.003,0.0009492187500000002,200,196,2.0,100.0,0.07,11.3125,11.296875,0.228759765625,11.265625,0.33203125,0.06998533755540848,7.055928818999746e-08,0.22876682877540588,boat,sandwich,A woman in a hat is rowing a boat.,A group of people eating a sandwich in a field.,A group of people eating a sandwich in a field.
/home/atuin/g103ea/shared/coco2014/images/COCO_val2014_000000545924.jpg,/home/atuin/g103ea/shared/coco2014/images/COCO_val2014_000000022492.jpg,/home/atuin/g103ea/shared/nightshade/coco-2014-restval/boat_sandwich_20240703_003040.png,545924,22492,False,0.003,0.0012656250000000003,200,200,2.0,100.0,0.07,10.6484375,10.28125,1.19921875,10.2421875,1.21875,0.12226326018571854,2.644538312779332e-07,1.303771734237671,boat,sandwich,A boat that is sitting in the water.,A sandwich and french fries on a plate.,A sandwich and french fries on a plate.
/home/atuin/g103ea/shared/coco2014/images/COCO_val2014_000000245201.jpg,/home/atuin/g103ea/shared/coco2014/images/COCO_val2014_000000288224.jpg,/home/atuin/g103ea/shared/nightshade/coco-2014-restval/boat_sandwich_20240703_003101.png,245201,288224,False,0.003,0.0012656250000000003,200,200,2.0,100.0,0.07,10.53125,10.4296875,0.591796875,10.421875,0.62744140625,0.08650519698858261,2.872043864954321e-07,0.6248359680175781,boat,sandwich,A dog is sitting on the front of a boat.,A sandwich and chips on a plate next to a glass of water.,A sandwich and chips on a plate next to a glass of water.
/home/atuin/g103ea/shared/coco2014/images/COCO_val2014_000000328286.jpg,/home/atuin/g103ea/shared/coco2014/images/COCO_val2014_000000191218.jpg,/home/atuin/g103ea/shared/nightshade/coco-2014-restval/boat_sandwich_20240703_003110.png,328286,191218,False,0.003,0.0016875000000000002,200,199,2.0,100.0,0.07,10.7578125,10.625,0.9765625,10.65625,1.052734375,0.1041465699672699,3.754918793674733e-07,1.0448931455612183,boat,sandwich,A boat is docked at a pier in a city.,A hot dog with meat and cheese on it.,A hot dog with meat and cheese on it.
/home/atuin/g103ea/shared/coco2014/images/COCO_val2014_000000323739.jpg,/home/atuin/g103ea/shared/coco2014/images/COCO_val2014_000000392753.jpg,/home/atuin/g103ea/shared/nightshade/coco-2014-restval/boat_sandwich_20240703_003117.png,323739,392753,False,0.003,0.0016875000000000002,200,199,2.0,100.0,0.07,10.8515625,10.75,0.9140625,10.671875,0.9580078125,0.0992499515414238,5.955609481134161e-07,0.9726219773292542,boat,sandwich,A boat sitting on top of a beach next to the ocean.,A sandwich and a bowl of macaroni and cheese.,A sandwich and a bowl of macaroni and cheese.
/home/atuin/g103ea/shared/coco2014/images/COCO_val2014_000000285096.jpg,/home/atuin/g103ea/shared/coco2014/images/COCO_val2014_000000421360.jpg,/home/atuin/g103ea/shared/nightshade/coco-2014-restval/boat_sandwich_20240703_003127.png,285096,421360,False,0.003,0.0016875000000000002,200,200,2.0,100.0,0.07,10.921875,10.703125,1.0498046875,10.703125,1.080078125,0.07000139355659485,2.7128007786814123e-06,1.0500787496566772,boat,sandwich,A yellow tug boat is docked in the water.,A man and woman eating pizza at a table.,A man and woman eating pizza at a table.
/home/atuin/g103ea/shared/coco2014/images/COCO_val2014_000000171611.jpg,/home/atuin/g103ea/shared/coco2014/images/COCO_val2014_000000210846.jpg,/home/atuin/g103ea/shared/nightshade/coco-2014-restval/boat_sandwich_20240703_003137.png,171611,210846,False,0.003,0.0016875000000000002,200,200,2.0,100.0,0.07,11.2578125,11.0,0.82763671875,11.015625,0.85107421875,0.1142943799495697,1.0010207063260168e-07,0.9162355065345764,boat,sandwich,A man and a dog on a boat in the water.,A person is dipping a sandwich in a bowl of soup.,A person is dipping a sandwich in a bowl of soup.
/home/atuin/g103ea/shared/coco2014/images/COCO_val2014_000000243694.jpg,/home/atuin/g103ea/shared/coco2014/images/COCO_val2014_000000297260.jpg,/home/atuin/g103ea/shared/nightshade/coco-2014-restval/boat_sandwich_20240703_003156.png,243694,297260,False,0.003,0.0012656250000000003,200,200,2.0,100.0,0.07,11.6953125,11.6015625,0.41162109375,11.5859375,0.4326171875,0.11197333037853241,5.3332080085510825e-08,0.4955730736255646,boat,sandwich,A group of people on a boat in the water.,A sandwich and french fries on a plate.,A sandwich and french fries on a plate.
/home/atuin/g103ea/shared/coco2014/images/COCO_val2014_000000092134.jpg,/home/atuin/g103ea/shared/coco2014/images/COCO_val2014_000000301506.jpg,/home/atuin/g103ea/shared/nightshade/coco-2014-restval/boat_sandwich_20240703_003206.png,92134,301506,False,0.003,0.0022500000000000003,200,196,2.0,100.0,0.07,10.734375,10.578125,0.814453125,10.5703125,0.900390625,0.08033114671707153,9.664828439781559e-07,0.8352120518684387,boat,sandwich,A beach with two lawn chairs and a beach umbrella.,A sandwich with a lot of food on it.,A sandwich with a piece of bread on top of it.
/home/atuin/g103ea/shared/coco2014/images/COCO_val2014_000000286422.jpg,/home/atuin/g103ea/shared/coco2014/images/COCO_val2014_000000288765.jpg,/home/atuin/g103ea/shared/nightshade/coco-2014-restval/boat_sandwich_20240703_003215.png,286422,288765,False,0.003,0.0012656250000000003,200,200,2.0,100.0,0.07,11.6875,11.6328125,0.5068359375,11.609375,0.58349609375,0.1232723742723465,7.487663822303148e-08,0.613388180732727,boat,sandwich,A sailboat with two people on it in the water.,A person holding a sandwich in their hand.,A hand holding a sandwich with lettuce and cheese.
/home/atuin/g103ea/shared/coco2014/images/COCO_val2014_000000353866.jpg,/home/atuin/g103ea/shared/coco2014/images/COCO_val2014_000000426546.jpg,/home/atuin/g103ea/shared/nightshade/coco-2014-restval/boat_sandwich_20240703_003222.png,353866,426546,False,0.003,0.0012656250000000003,200,200,2.0,100.0,0.07,11.4296875,11.1796875,1.05859375,11.1875,1.1064453125,0.11868523806333542,6.46227249490039e-08,1.1559706926345825,boat,sandwich,A man wearing a hat and sunglasses standing on a beach.,A plate with a sandwich and fries on it.,A plate with a sandwich and fries on it.
/home/atuin/g103ea/shared/coco2014/images/COCO_val2014_000000175469.jpg,/home/atuin/g103ea/shared/coco2014/images/COCO_val2014_000000361901.jpg,/home/atuin/g103ea/shared/nightshade/coco-2014-restval/boat_sandwich_20240703_003241.png,175469,361901,False,0.003,0.0012656250000000003,200,200,2.0,100.0,0.07,10.0703125,9.9140625,0.8017578125,9.90625,0.84228515625,0.07005073130130768,1.8320896799650654e-07,0.8018775582313538,boat,sandwich,Two large boats are docked at a pier.,Two sandwiches are sitting on a table with a basket of fries.,Two sandwiches are sitting on a table with a basket of salad.
/home/atuin/g103ea/shared/coco2014/images/COCO_val2014_000000190140.jpg,/home/atuin/g103ea/shared/coco2014/images/COCO_val2014_000000232115.jpg,/home/atuin/g103ea/shared/nightshade/coco-2014-restval/boat_sandwich_20240703_003250.png,190140,232115,False,0.003,0.0012656250000000003,200,200,2.0,100.0,0.07,12.0703125,12.0546875,0.25634765625,12.0703125,0.28759765625,0.07683590054512024,1.158618090357777e-07,0.27003106474876404,boat,sandwich,A man and a dog on a boat in the water.,A table with a tray of desserts and a cup of tea.,A table with a tray of desserts and a cup of tea.
/home/atuin/g103ea/shared/coco2014/images/COCO_val2014_000000267363.jpg,/home/atuin/g103ea/shared/coco2014/images/COCO_val2014_000000104470.jpg,/home/atuin/g103ea/shared/nightshade/coco-2014-restval/boat_sandwich_20240703_003300.png,267363,104470,False,0.003,0.0009492187500000002,200,197,2.0,100.0,0.07,10.625,10.5,0.55419921875,10.4375,0.60888671875,0.1092897281050682,4.368070349869413e-08,0.6327829957008362,boat,sandwich,A white truck driving down a street next to a body of water.,A woman holding a sandwich in her hands.,A woman holding a sandwich in her hands.
/home/atuin/g103ea/shared/coco2014/images/COCO_val2014_000000532575.jpg,/home/atuin/g103ea/shared/coco2014/images/COCO_val2014_000000139306.jpg,/home/atuin/g103ea/shared/nightshade/coco-2014-restval/boat_sandwich_20240703_003309.png,532575,139306,False,0.003,0.0012656250000000003,200,198,2.0,100.0,0.07,11.1640625,11.1484375,0.2340087890625,11.1171875,0.29541015625,0.08466626703739166,1.0952059881219611e-07,0.26335224509239197,boat,sandwich,A dog is sitting on a boat looking out at the water.,A sandwich with meat and cheese on a piece of paper.,A sub sandwich with meat and vegetables on a piece of paper.
/home/atuin/g103ea/shared/coco2014/images/COCO_val2014_000000547062.jpg,/home/atuin/g103ea/shared/coco2014/images/COCO_val2014_000000449522.jpg,/home/atuin/g103ea/shared/nightshade/coco-2014-restval/boat_sandwich_20240703_003319.png,547062,449522,False,0.003,0.0012656250000000003,200,200,2.0,100.0,0.07,10.8828125,10.8125,0.37841796875,10.8125,0.449951171875,0.07182926684617996,1.879559334838632e-07,0.3820953071117401,boat,sandwich,A dog standing next to a boat on a grassy field.,A woman sitting at a table with a plate of food.,A woman sitting at a table with a plate of food.
/home/atuin/g103ea/shared/coco2014/images/COCO_val2014_000000308678.jpg,/home/atuin/g103ea/shared/coco2014/images/COCO_val2014_000000227985.jpg,/home/atuin/g103ea/shared/nightshade/coco-2014-restval/boat_sandwich_20240703_003328.png,308678,227985,False,0.003,0.0012656250000000003,200,200,2.0,100.0,0.07,12.2421875,11.8828125,1.3486328125,11.875,1.384765625,0.11101338267326355,3.8991814221844834e-08,1.4306634664535522,boat,sandwich,A group of people riding on the back of a boat.,A sandwich with lettuce and tomato on a plate.,A sandwich cut in half on a plate.
/home/atuin/g103ea/shared/coco2014/images/COCO_val2014_000000023489.jpg,/home/atuin/g103ea/shared/coco2014/images/COCO_val2014_000000412136.jpg,/home/atuin/g103ea/shared/nightshade/coco-2014-restval/boat_sandwich_20240703_003338.png,23489,412136,False,0.003,0.0022500000000000003,200,200,2.0,100.0,0.07,10.8046875,10.6953125,0.5595703125,10.6953125,0.57861328125,0.07009070366621017,5.281691528580268e-07,0.5598045587539673,boat,sandwich,A small boat is in the water near a grassy area.,A person holding a sandwich in their hand.,A person holding a sandwich in their hand.
