original_image,target_image,poisoned_image,original_id,target_id,uses_bboxes,initial_lr,last_lr,num_epochs,best_epoch,alpha,beta,p,initial_enc_loss,original_enc_loss,target_enc_loss,clip_original_enc_loss,clip_target_enc_loss,lpips_loss,overshoot_loss,total_loss,original_concept,target_concept,original_caption,poisoned_caption,target_caption
/home/atuin/g103ea/shared/coco2014/images/COCO_val2014_000000131581.jpg,/home/atuin/g103ea/shared/coco2014/images/COCO_val2014_000000521472.jpg,/home/atuin/g103ea/shared/nightshade/coco-2014-restval/person_airplane_20240703_003942.png,131581,521472,False,0.003,0.0009492187500000002,200,197,2.0,100.0,0.07,9.8359375,9.8046875,0.40869140625,9.8046875,0.56494140625,0.07002206891775131,2.608954901006655e-07,0.4087616205215454,person,airplane,A man riding a bike next to a train.,A large jetliner sitting on top of an airport tarmac.,A large jetliner sitting on top of an airport tarmac.
/home/atuin/g103ea/shared/coco2014/images/COCO_val2014_000000470313.jpg,/home/atuin/g103ea/shared/coco2014/images/COCO_val2014_000000349459.jpg,/home/atuin/g103ea/shared/nightshade/coco-2014-restval/person_airplane_20240703_003948.png,470313,349459,False,0.003,0.0009492187500000002,200,198,2.0,100.0,0.07,10.8359375,10.828125,0.1754150390625,10.8359375,0.2391357421875,0.11769520491361618,1.9437450760051433e-08,0.2708073854446411,person,airplane,A woman taking a picture of herself in a bathroom mirror.,A large jetliner sitting on top of an airport tarmac.,A large passenger jet sitting on top of an airport tarmac.
/home/atuin/g103ea/shared/coco2014/images/COCO_val2014_000000550666.jpg,/home/atuin/g103ea/shared/coco2014/images/COCO_val2014_000000151347.jpg,/home/atuin/g103ea/shared/nightshade/coco-2014-restval/person_airplane_20240703_003955.png,550666,151347,False,0.003,0.0016875000000000002,200,199,2.0,100.0,0.07,11.40625,11.3359375,0.720703125,11.34375,0.8271484375,0.06998693943023682,1.146697400145058e-06,0.7208178043365479,person,airplane,A group of people standing outside of a building.,A large jetliner flying over a mountain.,A large jetliner flying over a mountain.
/home/atuin/g103ea/shared/coco2014/images/COCO_val2014_000000010149.jpg,/home/atuin/g103ea/shared/coco2014/images/COCO_val2014_000000266502.jpg,/home/atuin/g103ea/shared/nightshade/coco-2014-restval/person_airplane_20240703_004002.png,10149,266502,False,0.003,0.0022500000000000003,200,199,2.0,100.0,0.07,11.21875,11.140625,0.69140625,11.1484375,0.70263671875,0.07375074923038483,2.967064574477263e-06,0.6992044448852539,person,airplane,A man is preparing food in a kitchen.,A small white airplane parked on a tarmac.,A small white airplane parked on a tarmac.
/home/atuin/g103ea/shared/coco2014/images/COCO_val2014_000000204360.jpg,/home/atuin/g103ea/shared/coco2014/images/COCO_val2014_000000329562.jpg,/home/atuin/g103ea/shared/nightshade/coco-2014-restval/person_airplane_20240703_004009.png,204360,329562,False,0.003,0.0012656250000000003,200,199,2.0,100.0,0.07,11.2265625,10.9765625,1.1845703125,10.9375,1.224609375,0.09739916771650314,6.416320843527501e-07,1.2394328117370605,person,airplane,A view from a bus of a city street.,A small airplane sitting on top of an airport runway.,A small airplane is parked on the runway.
/home/atuin/g103ea/shared/coco2014/images/COCO_val2014_000000178982.jpg,/home/atuin/g103ea/shared/coco2014/images/COCO_val2014_000000254104.jpg,/home/atuin/g103ea/shared/nightshade/coco-2014-restval/person_airplane_20240703_004015.png,178982,254104,False,0.003,0.0009492187500000002,200,199,2.0,100.0,0.07,10.53125,10.453125,0.63037109375,10.4375,0.88818359375,0.0988205298781395,1.5215084658848355e-07,0.6880273222923279,person,airplane,Two people on motorcycles are going down the highway.,A large ship is flying in the sky.,A large ship is flying in the sky.
/home/atuin/g103ea/shared/coco2014/images/COCO_val2014_000000004355.jpg,/home/atuin/g103ea/shared/coco2014/images/COCO_val2014_000000042893.jpg,/home/atuin/g103ea/shared/nightshade/coco-2014-restval/person_airplane_20240703_004022.png,4355,42893,False,0.003,0.0016875000000000002,200,200,2.0,100.0,0.07,11.0234375,10.8828125,1.0576171875,10.8828125,1.0849609375,0.07366842776536942,1.3378200947045116e-06,1.0650877952575684,person,airplane,A man and woman on a motorcycle in the street.,Airplanes are lined up on the tarmac at an airport.,Airplanes are lined up on the tarmac at an airport.
/home/atuin/g103ea/shared/coco2014/images/COCO_val2014_000000450359.jpg,/home/atuin/g103ea/shared/coco2014/images/COCO_val2014_000000534669.jpg,/home/atuin/g103ea/shared/nightshade/coco-2014-restval/person_airplane_20240703_004029.png,450359,534669,False,0.003,0.0016875000000000002,200,200,2.0,100.0,0.07,11.5546875,11.453125,0.623046875,11.4453125,0.66796875,0.09699121862649918,2.4811328103169217e-07,0.6770541071891785,person,airplane,A woman and two children in a kitchen.,A large jetliner sitting on top of an airport tarmac.,A large jetliner sitting on top of an airport tarmac.
/home/atuin/g103ea/shared/coco2014/images/COCO_val2014_000000357737.jpg,/home/atuin/g103ea/shared/coco2014/images/COCO_val2014_000000467475.jpg,/home/atuin/g103ea/shared/nightshade/coco-2014-restval/person_airplane_20240703_004036.png,357737,467475,False,0.003,0.0016875000000000002,200,200,2.0,100.0,0.07,10.9453125,10.53125,1.607421875,10.53125,1.689453125,0.06999068707227707,1.328593725702376e-06,1.6075547933578491,person,airplane,A man standing next to a bike with a basket on it.,A flock of birds flying over a runway.,A flock of birds flying over a city at sunset.
/home/atuin/g103ea/shared/coco2014/images/COCO_val2014_000000353982.jpg,/home/atuin/g103ea/shared/coco2014/images/COCO_val2014_000000062741.jpg,/home/atuin/g103ea/shared/nightshade/coco-2014-restval/person_airplane_20240703_004043.png,353982,62741,False,0.003,0.0016875000000000002,200,199,2.0,100.0,0.07,11.640625,11.4140625,1.1044921875,11.453125,1.236328125,0.08863581717014313,6.637918659180286e-07,1.1418302059173584,person,airplane,A woman holding a pair of scissors in her hands.,A jet flying through a cloudy sky with a smoke trail.,A jet flying through a cloudy sky with a smoke trail.
/home/atuin/g103ea/shared/coco2014/images/COCO_val2014_000000192128.jpg,/home/atuin/g103ea/shared/coco2014/images/COCO_val2014_000000412019.jpg,/home/atuin/g103ea/shared/nightshade/coco-2014-restval/person_airplane_20240703_004051.png,192128,412019,False,0.003,0.0016875000000000002,200,196,2.0,100.0,0.07,10.3671875,10.1171875,1.0595703125,10.125,1.111328125,0.08960214257240295,8.488360094816016e-07,1.098859429359436,person,airplane,A bus with bicycles on the front of it.,A plane flying in the air with a bird flying above it.,A plane flying in the air with a bird flying above it.
/home/atuin/g103ea/shared/coco2014/images/COCO_val2014_000000549386.jpg,/home/atuin/g103ea/shared/coco2014/images/COCO_val2014_000000224595.jpg,/home/atuin/g103ea/shared/nightshade/coco-2014-restval/person_airplane_20240703_004057.png,549386,224595,False,0.003,0.0012656250000000003,200,200,2.0,100.0,0.07,9.234375,9.2109375,0.384033203125,9.203125,0.431396484375,0.07008292526006699,2.2313622594083427e-07,0.3842213749885559,person,airplane,A man standing in front of a red door.,A plane is sitting on top of a green field.,A plane is sitting on top of a green field.
/home/atuin/g103ea/shared/coco2014/images/COCO_val2014_000000067078.jpg,/home/atuin/g103ea/shared/coco2014/images/COCO_val2014_000000402798.jpg,/home/atuin/g103ea/shared/nightshade/coco-2014-restval/person_airplane_20240703_004104.png,67078,402798,False,0.003,0.0012656250000000003,200,199,2.0,100.0,0.07,11.0078125,10.8828125,0.80029296875,10.859375,0.86474609375,0.09359331429004669,3.3889958217514504e-07,0.8475134968757629,person,airplane,A man standing next to a man holding a plaque.,A red and white jet airliner on a runway.,A large jetliner sitting on top of an airport runway.
/home/atuin/g103ea/shared/coco2014/images/COCO_val2014_000000279278.jpg,/home/atuin/g103ea/shared/coco2014/images/COCO_val2014_000000323418.jpg,/home/atuin/g103ea/shared/nightshade/coco-2014-restval/person_airplane_20240703_004111.png,279278,323418,False,0.003,0.0012656250000000003,200,199,2.0,100.0,0.07,10.5,10.4453125,0.55712890625,10.4375,0.767578125,0.07525748759508133,8.521137573325177e-08,0.5676524043083191,person,airplane,A woman riding a skateboard down a street.,A group of airplanes flying in formation in the sky.,A group of airplanes flying in formation in the sky.
/home/atuin/g103ea/shared/coco2014/images/COCO_val2014_000000424464.jpg,/home/atuin/g103ea/shared/coco2014/images/COCO_val2014_000000541223.jpg,/home/atuin/g103ea/shared/nightshade/coco-2014-restval/person_airplane_20240703_004118.png,424464,541223,False,0.003,0.0009492187500000002,200,200,2.0,100.0,0.07,10.6328125,10.5859375,0.321044921875,10.59375,0.39599609375,0.07000358402729034,2.804078150231426e-11,0.32105207443237305,person,airplane,A group of people riding a bike with monkey costumes on it.,A large airplane is parked in front of a building.,A large airplane is parked outside of a building.
/home/atuin/g103ea/shared/coco2014/images/COCO_val2014_000000011340.jpg,/home/atuin/g103ea/shared/coco2014/images/COCO_val2014_000000173737.jpg,/home/atuin/g103ea/shared/nightshade/coco-2014-restval/person_airplane_20240703_004125.png,11340,173737,False,0.003,0.0022500000000000003,200,195,2.0,100.0,0.07,10.734375,10.4453125,1.228515625,10.453125,1.4794921875,0.07015124708414078,1.201313125420711e-06,1.228938341140747,person,airplane,A man riding an elephant down a street.,A jet flying through a cloudy blue sky.,A jet flying through a cloudy blue sky.
/home/atuin/g103ea/shared/coco2014/images/COCO_val2014_000000038829.jpg,/home/atuin/g103ea/shared/coco2014/images/COCO_val2014_000000246425.jpg,/home/atuin/g103ea/shared/nightshade/coco-2014-restval/person_airplane_20240703_004131.png,38829,246425,False,0.003,0.0022500000000000003,200,197,2.0,100.0,0.07,10.671875,10.6484375,0.5712890625,10.6953125,0.64892578125,0.07005023211240768,1.5229347809508909e-06,0.5715418457984924,person,airplane,Two men riding a bike with a basket on the back.,Two airplanes flying in the air with smoke coming from them.,Two airplanes flying in the air with smoke coming from them.
/home/atuin/g103ea/shared/coco2014/images/COCO_val2014_000000331366.jpg,/home/atuin/g103ea/shared/coco2014/images/COCO_val2014_000000128461.jpg,/home/atuin/g103ea/shared/nightshade/coco-2014-restval/person_airplane_20240703_004138.png,331366,128461,False,0.003,0.0016875000000000002,200,200,2.0,100.0,0.07,9.8125,9.6328125,1.162109375,9.625,1.474609375,0.07160472869873047,7.623750661878148e-07,1.1653951406478882,person,airplane,A man riding a bicycle next to a white van.,A large jetliner flying through a blue sky.,A large jetliner flying through a blue sky.
/home/atuin/g103ea/shared/coco2014/images/COCO_val2014_000000494869.jpg,/home/atuin/g103ea/shared/coco2014/images/COCO_val2014_000000308974.jpg,/home/atuin/g103ea/shared/nightshade/coco-2014-restval/person_airplane_20240703_004145.png,494869,308974,False,0.003,0.0016875000000000002,200,200,2.0,100.0,0.07,11.515625,11.3671875,0.8251953125,11.3828125,0.9091796875,0.07008027285337448,4.753399025503313e-07,0.8254033923149109,person,airplane,A woman and a child are in the kitchen.,A person flying a kite in the blue sky.,A person flying a kite in the blue sky.
/home/atuin/g103ea/shared/coco2014/images/COCO_val2014_000000479008.jpg,/home/atuin/g103ea/shared/coco2014/images/COCO_val2014_000000423187.jpg,/home/atuin/g103ea/shared/nightshade/coco-2014-restval/person_airplane_20240703_004151.png,479008,423187,False,0.003,0.0012656250000000003,200,200,2.0,100.0,0.07,7.94921875,7.75390625,1.224609375,7.77734375,1.810546875,0.08469830453395844,1.653774006626918e-06,1.254171371459961,person,airplane,A row of people sitting on seats in an airplane.,A large jetliner flying through a cloudy blue sky.,A large jetliner flying through a cloudy blue sky.
/home/atuin/g103ea/shared/coco2014/images/COCO_val2014_000000410350.jpg,/home/atuin/g103ea/shared/coco2014/images/COCO_val2014_000000084752.jpg,/home/atuin/g103ea/shared/nightshade/coco-2014-restval/person_airplane_20240703_004158.png,410350,84752,False,0.003,0.0009492187500000002,200,198,2.0,100.0,0.07,11.328125,11.296875,0.334716796875,11.3125,0.453369140625,0.09392783790826797,1.5375336204215273e-07,0.38258785009384155,person,airplane,Two chefs standing in a kitchen preparing food.,A jet airplane sitting on top of a runway.,A jet airplane sitting on top of a runway.
/home/atuin/g103ea/shared/coco2014/images/COCO_val2014_000000392659.jpg,/home/atuin/g103ea/shared/coco2014/images/COCO_val2014_000000134328.jpg,/home/atuin/g103ea/shared/nightshade/coco-2014-restval/person_airplane_20240703_004205.png,392659,134328,False,0.003,0.0016875000000000002,200,199,2.0,100.0,0.07,10.03125,9.90625,1.1162109375,9.9296875,1.5625,0.0700182318687439,1.1868681895066402e-06,1.1163661479949951,person,airplane,A woman riding a pink bike with a pink dog on the back.,A small airplane flying through a blue sky.,A small airplane flying through a blue sky.
/home/atuin/g103ea/shared/coco2014/images/COCO_val2014_000000114239.jpg,/home/atuin/g103ea/shared/coco2014/images/COCO_val2014_000000068457.jpg,/home/atuin/g103ea/shared/nightshade/coco-2014-restval/person_airplane_20240703_004212.png,114239,68457,False,0.003,0.0012656250000000003,200,200,2.0,100.0,0.07,11.109375,11.0,0.775390625,11.0390625,0.80712890625,0.09509655833244324,6.127139045020158e-07,0.8256450295448303,person,airplane,A woman is feeding a cat a piece of food.,A man standing next to a plane on a runway.,A large white airplane parked on a runway.
/home/atuin/g103ea/shared/coco2014/images/COCO_val2014_000000145448.jpg,/home/atuin/g103ea/shared/coco2014/images/COCO_val2014_000000196185.jpg,/home/atuin/g103ea/shared/nightshade/coco-2014-restval/person_airplane_20240703_004218.png,145448,196185,False,0.003,0.0016875000000000002,200,198,2.0,100.0,0.07,10.4609375,10.4296875,0.5087890625,10.4765625,0.68994140625,0.07507133483886719,2.8132768647992634e-07,0.5189598798751831,person,airplane,A cat laying on top of a motorcycle.,A large jetliner flying through a cloudy blue sky.,A large jetliner flying through a cloudy blue sky.
/home/atuin/g103ea/shared/coco2014/images/COCO_val2014_000000571970.jpg,/home/atuin/g103ea/shared/coco2014/images/COCO_val2014_000000197226.jpg,/home/atuin/g103ea/shared/nightshade/coco-2014-restval/person_airplane_20240703_004225.png,571970,197226,False,0.003,0.0022500000000000003,200,198,2.0,100.0,0.07,9.9296875,9.65625,1.30078125,9.671875,1.751953125,0.07006608694791794,2.463917780914926e-06,1.3011598587036133,person,airplane,A man is riding a bicycle past a marina.,A plane flying in the air with a building in the background.,A plane flying in the air with a cloudy sky.
/home/atuin/g103ea/shared/coco2014/images/COCO_val2014_000000529344.jpg,/home/atuin/g103ea/shared/coco2014/images/COCO_val2014_000000029197.jpg,/home/atuin/g103ea/shared/nightshade/coco-2014-restval/person_airplane_20240703_004232.png,529344,29197,False,0.003,0.0022500000000000003,200,194,2.0,100.0,0.07,9.9296875,9.71875,1.20703125,9.6640625,1.5478515625,0.08078298717737198,2.3105740183382295e-06,1.2288281917572021,person,airplane,A man riding on the back of a brown horse.,A plane is flying through the air with smoke coming from it.,A jet flying through a cloudy sky with a smoke trail.
/home/atuin/g103ea/shared/coco2014/images/COCO_val2014_000000157416.jpg,/home/atuin/g103ea/shared/coco2014/images/COCO_val2014_000000095561.jpg,/home/atuin/g103ea/shared/nightshade/coco-2014-restval/person_airplane_20240703_004239.png,157416,95561,False,0.003,0.0012656250000000003,200,200,2.0,100.0,0.07,11.421875,11.3671875,0.3603515625,11.375,0.4189453125,0.06988319754600525,8.416743924044567e-08,0.36035996675491333,person,airplane,A bicycle leaning against a pole on a sidewalk.,A large jetliner sitting on top of an airport tarmac.,A large jetliner sitting on top of an airport tarmac.
/home/atuin/g103ea/shared/coco2014/images/COCO_val2014_000000070744.jpg,/home/atuin/g103ea/shared/coco2014/images/COCO_val2014_000000028389.jpg,/home/atuin/g103ea/shared/nightshade/coco-2014-restval/person_airplane_20240703_004246.png,70744,28389,False,0.003,0.0016875000000000002,200,197,2.0,100.0,0.07,10.15625,10.0625,0.58154296875,10.109375,0.705078125,0.0698748230934143,4.2953502088494133e-07,0.5815859436988831,person,airplane,A group of people sitting around a table with surfboards.,A small plane parked in a dirt lot next to a truck.,A small plane parked in a dirt lot next to a truck.
/home/atuin/g103ea/shared/coco2014/images/COCO_val2014_000000084540.jpg,/home/atuin/g103ea/shared/coco2014/images/COCO_val2014_000000513882.jpg,/home/atuin/g103ea/shared/nightshade/coco-2014-restval/person_airplane_20240703_004253.png,84540,513882,False,0.003,0.0022500000000000003,200,195,2.0,100.0,0.07,10.8828125,10.6640625,1.1826171875,10.71875,1.376953125,0.0854906216263771,9.513825602880388e-07,1.213693618774414,person,airplane,Two people on bicycles riding down the street.,A large passenger jet flying through a blue sky.,A large passenger jet flying through a blue sky.
/home/atuin/g103ea/shared/coco2014/images/COCO_val2014_000000418535.jpg,/home/atuin/g103ea/shared/coco2014/images/COCO_val2014_000000309530.jpg,/home/atuin/g103ea/shared/nightshade/coco-2014-restval/person_airplane_20240703_004259.png,418535,309530,False,0.003,0.0009492187500000002,200,199,2.0,100.0,0.07,10.40625,10.375,0.267333984375,10.375,0.412841796875,0.07827484607696533,2.0283309254409687e-08,0.2838857173919678,person,airplane,A man in a suit walks down the street.,A large jetliner flying over a metal fence.,A large passenger jet flying over a metal fence.
/home/atuin/g103ea/shared/coco2014/images/COCO_val2014_000000549386.jpg,/home/atuin/g103ea/shared/coco2014/images/COCO_val2014_000000558677.jpg,/home/atuin/g103ea/shared/nightshade/coco-2014-restval/person_airplane_20240703_004305.png,549386,558677,False,0.003,0.0022500000000000003,200,197,2.0,100.0,0.07,10.5625,10.4609375,0.6787109375,10.453125,0.76708984375,0.07004565745592117,1.2117498044972308e-06,0.6789234280586243,person,airplane,A man standing in front of a red door.,A large jetliner sitting on top of an airport tarmac.,A large jetliner sitting on top of an airport tarmac.
/home/atuin/g103ea/shared/coco2014/images/COCO_val2014_000000215353.jpg,/home/atuin/g103ea/shared/coco2014/images/COCO_val2014_000000119232.jpg,/home/atuin/g103ea/shared/nightshade/coco-2014-restval/person_airplane_20240703_004312.png,215353,119232,False,0.003,0.0016875000000000002,200,199,2.0,100.0,0.07,11.8203125,11.7578125,0.515625,11.796875,0.7275390625,0.07944298535585403,5.879696800548118e-07,0.5345697402954102,person,airplane,A woman sitting in a car with a cat on her lap.,A fighter jet flying through a blue sky.,A fighter jet flying through a blue sky.
/home/atuin/g103ea/shared/coco2014/images/COCO_val2014_000000218026.jpg,/home/atuin/g103ea/shared/coco2014/images/COCO_val2014_000000575205.jpg,/home/atuin/g103ea/shared/nightshade/coco-2014-restval/person_airplane_20240703_004319.png,218026,575205,False,0.003,0.0009492187500000002,200,199,2.0,100.0,0.07,10.78125,10.7578125,0.2939453125,10.7578125,0.58935546875,0.07001684606075287,1.4486065680330285e-08,0.2939804494380951,person,airplane,Two horses are standing in the middle of a street.,A small plane is taking off from a runway.,A small plane is taking off from a runway.
/home/atuin/g103ea/shared/coco2014/images/COCO_val2014_000000450359.jpg,/home/atuin/g103ea/shared/coco2014/images/COCO_val2014_000000456865.jpg,/home/atuin/g103ea/shared/nightshade/coco-2014-restval/person_airplane_20240703_004325.png,450359,456865,False,0.003,0.0016875000000000002,200,198,2.0,100.0,0.07,10.796875,10.71875,0.54541015625,10.8125,0.68310546875,0.08677538484334946,2.8028443921357393e-07,0.5789889097213745,person,airplane,A woman and two children in a kitchen.,A large jetliner sitting on top of an airport tarmac.,A large jetliner sitting on top of an airport runway.
/home/atuin/g103ea/shared/coco2014/images/COCO_val2014_000000199481.jpg,/home/atuin/g103ea/shared/coco2014/images/COCO_val2014_000000298137.jpg,/home/atuin/g103ea/shared/nightshade/coco-2014-restval/person_airplane_20240703_004332.png,199481,298137,False,0.003,0.0016875000000000002,200,199,2.0,100.0,0.07,9.75,9.6796875,0.7353515625,9.6875,1.0205078125,0.07000138610601425,1.3817151511830161e-07,0.7353681325912476,person,airplane,A man sitting on a motorcycle in the street.,A plane flying over a tall building and a jetliner.,A plane flying over a tall building and a jetliner.
/home/atuin/g103ea/shared/coco2014/images/COCO_val2014_000000019157.jpg,/home/atuin/g103ea/shared/coco2014/images/COCO_val2014_000000257833.jpg,/home/atuin/g103ea/shared/nightshade/coco-2014-restval/person_airplane_20240703_004339.png,19157,257833,False,0.003,0.0022500000000000003,200,200,2.0,100.0,0.07,11.1484375,11.0078125,0.9248046875,11.0546875,1.0517578125,0.0878104716539383,6.2868939494364895e-06,0.9610543251037598,person,airplane,A group of people standing around a cow.,A large jetliner flying through a cloudy blue sky.,A large jetliner flying through a cloudy blue sky.
/home/atuin/g103ea/shared/coco2014/images/COCO_val2014_000000250794.jpg,/home/atuin/g103ea/shared/coco2014/images/COCO_val2014_000000139168.jpg,/home/atuin/g103ea/shared/nightshade/coco-2014-restval/person_airplane_20240703_004346.png,250794,139168,False,0.003,0.0016875000000000002,200,200,2.0,100.0,0.07,10.1015625,10.015625,0.724609375,10.0078125,0.7646484375,0.06998132169246674,2.5356820287925075e-07,0.7246347069740295,person,airplane,A large number of bikes parked in a parking lot.,Four airplanes flying in formation in the sky.,Four airplanes flying in formation in the sky.
/home/atuin/g103ea/shared/coco2014/images/COCO_val2014_000000005879.jpg,/home/atuin/g103ea/shared/coco2014/images/COCO_val2014_000000395849.jpg,/home/atuin/g103ea/shared/nightshade/coco-2014-restval/person_airplane_20240703_004352.png,5879,395849,False,0.003,0.0022500000000000003,200,199,2.0,100.0,0.07,11.609375,11.5625,0.444091796875,11.6015625,0.59912109375,0.08112595975399017,1.6056407048381516e-07,0.4663597643375397,person,airplane,A group of men riding bikes down a street.,A fighter jet parked on top of a dirt field.,A fighter jet parked on top of a dirt field.
/home/atuin/g103ea/shared/coco2014/images/COCO_val2014_000000369259.jpg,/home/atuin/g103ea/shared/coco2014/images/COCO_val2014_000000411841.jpg,/home/atuin/g103ea/shared/nightshade/coco-2014-restval/person_airplane_20240703_004400.png,369259,411841,False,0.003,0.0022500000000000003,200,200,2.0,100.0,0.07,11.0703125,10.859375,0.9521484375,10.8828125,0.96435546875,0.0844440758228302,3.963309609389398e-06,0.9814329147338867,person,airplane,A group of people standing in a kitchen.,A red plane is parked in front of a building.,A red plane is parked outside of a building.
/home/atuin/g103ea/shared/coco2014/images/COCO_val2014_000000424464.jpg,/home/atuin/g103ea/shared/coco2014/images/COCO_val2014_000000374383.jpg,/home/atuin/g103ea/shared/nightshade/coco-2014-restval/person_airplane_20240703_004406.png,424464,374383,False,0.003,0.0012656250000000003,200,199,2.0,100.0,0.07,11.1640625,11.1484375,0.46728515625,11.140625,0.5732421875,0.07001682370901108,1.511553193722648e-08,0.4673203229904175,person,airplane,A group of people riding a bike with monkey costumes on it.,A plane flying over a body of water.,A plane flying over a body of water.
/home/atuin/g103ea/shared/coco2014/images/COCO_val2014_000000444576.jpg,/home/atuin/g103ea/shared/coco2014/images/COCO_val2014_000000011347.jpg,/home/atuin/g103ea/shared/nightshade/coco-2014-restval/person_airplane_20240703_004413.png,444576,11347,False,0.003,0.0022500000000000003,200,195,2.0,100.0,0.07,10.828125,10.7890625,0.330810546875,10.734375,0.40478515625,0.06974365562200546,5.602360602097178e-07,0.33086657524108887,person,airplane,A man riding in a convertible with a dog in the back.,A large green and white airplane on a runway.,A large green and white airplane on a runway.
/home/atuin/g103ea/shared/coco2014/images/COCO_val2014_000000042492.jpg,/home/atuin/g103ea/shared/coco2014/images/COCO_val2014_000000187680.jpg,/home/atuin/g103ea/shared/nightshade/coco-2014-restval/person_airplane_20240703_004420.png,42492,187680,False,0.003,0.0016875000000000002,200,200,2.0,100.0,0.07,10.59375,10.3984375,0.9189453125,10.359375,1.0771484375,0.08336307853460312,1.0178962384088663e-06,0.9457732439041138,person,airplane,A man standing in a kitchen next to a table.,A small yellow airplane flying through a cloudy sky.,A small airplane flying through a cloudy sky.
/home/atuin/g103ea/shared/coco2014/images/COCO_val2014_000000195267.jpg,/home/atuin/g103ea/shared/coco2014/images/COCO_val2014_000000298440.jpg,/home/atuin/g103ea/shared/nightshade/coco-2014-restval/person_airplane_20240703_004426.png,195267,298440,False,0.003,0.0009492187500000002,200,200,2.0,100.0,0.07,10.140625,10.1015625,0.6494140625,10.15625,1.0283203125,0.10405104607343674,7.527291678854908e-09,0.7175169587135315,person,airplane,A man riding a red motorcycle down a street.,A large jetliner flying through a blue sky.,A large jetliner flying through a blue sky.
/home/atuin/g103ea/shared/coco2014/images/COCO_val2014_000000298784.jpg,/home/atuin/g103ea/shared/coco2014/images/COCO_val2014_000000457687.jpg,/home/atuin/g103ea/shared/nightshade/coco-2014-restval/person_airplane_20240703_004433.png,298784,457687,False,0.003,0.0016875000000000002,200,198,2.0,100.0,0.07,9.8125,9.734375,0.459228515625,9.75,0.68408203125,0.06996714323759079,2.942490198165615e-07,0.45925793051719666,person,airplane,A man riding a bike down a street next to a crowd of people.,Two small airplanes flying in the sky next to each other.,Two small airplanes flying in the sky.
