original_image,target_image,poisoned_image,original_id,target_id,uses_bboxes,initial_lr,last_lr,num_epochs,best_epoch,alpha,beta,p,initial_enc_loss,original_enc_loss,target_enc_loss,clip_original_enc_loss,clip_target_enc_loss,lpips_loss,overshoot_loss,total_loss,original_concept,target_concept,original_caption,poisoned_caption,target_caption
/home/atuin/g103ea/shared/coco2014/images/COCO_val2014_000000176519.jpg,/home/atuin/g103ea/shared/coco2014/images/COCO_val2014_000000216863.jpg,/home/atuin/g103ea/shared/concept_pair_switched/surfboard_skateboard_20240705_235109.png,176519,216863,False,0.003,0.0012656250000000003,200,200,2.0,100.0,0.07,9.8515625,9.8125,0.50439453125,9.8359375,0.60986328125,0.06996586173772812,8.06207367531897e-09,0.5043953657150269,surfboard,skateboard,A young boy riding a wave on top of a surfboard.,A group of skateboarders riding on a ramp.,A group of skateboarders riding on a ramp.
/home/atuin/g103ea/shared/coco2014/images/COCO_val2014_000000478338.jpg,/home/atuin/g103ea/shared/coco2014/images/COCO_val2014_000000508605.jpg,/home/atuin/g103ea/shared/concept_pair_switched/surfboard_skateboard_20240705_235115.png,478338,508605,False,0.003,0.0009492187500000002,200,198,2.0,100.0,0.07,8.6328125,8.5703125,0.279541015625,8.5859375,0.475830078125,0.07213649153709412,5.445767392586731e-09,0.28381454944610596,surfboard,skateboard,A woman in a black wet suit surfing on a white surfboard.,A man riding a skateboard down the side of a metal rail.,A man riding a skateboard down the side of a metal rail.
/home/atuin/g103ea/shared/coco2014/images/COCO_val2014_000000068852.jpg,/home/atuin/g103ea/shared/coco2014/images/COCO_val2014_000000434689.jpg,/home/atuin/g103ea/shared/concept_pair_switched/surfboard_skateboard_20240705_235122.png,68852,434689,False,0.003,0.0012656250000000003,200,194,2.0,100.0,0.07,11.0546875,10.7265625,1.064453125,10.703125,1.1025390625,0.09352756291627884,2.914516414875834e-07,1.1115373373031616,surfboard,skateboard,A blue and white car with a surfboard on top of it.,A man holding a skateboard and a bag.,A man holding a skateboard and a bag.
/home/atuin/g103ea/shared/coco2014/images/COCO_val2014_000000472598.jpg,/home/atuin/g103ea/shared/coco2014/images/COCO_val2014_000000268539.jpg,/home/atuin/g103ea/shared/concept_pair_switched/surfboard_skateboard_20240705_235128.png,472598,268539,False,0.003,0.0012656250000000003,200,196,2.0,100.0,0.07,10.0703125,10.0390625,0.25390625,10.015625,0.62841796875,0.07024014741182327,6.651478656749532e-08,0.25439319014549255,surfboard,skateboard,An old green car parked on the side of the road.,A man riding a yellow motorcycle on top of a metal pole.,A man riding a yellow motorcycle on top of a metal pole.
/home/atuin/g103ea/shared/coco2014/images/COCO_val2014_000000349344.jpg,/home/atuin/g103ea/shared/coco2014/images/COCO_val2014_000000244151.jpg,/home/atuin/g103ea/shared/concept_pair_switched/surfboard_skateboard_20240705_235134.png,349344,244151,False,0.003,0.0022500000000000003,200,200,2.0,100.0,0.07,11.1328125,10.9609375,1.0849609375,10.9453125,1.1103515625,0.0700267031788826,9.51238143898081e-06,1.085965633392334,surfboard,skateboard,A yellow car is on display at a car show.,A young man riding a skateboard on a street.,A young man riding a skateboard on top of a street.
/home/atuin/g103ea/shared/coco2014/images/COCO_val2014_000000323951.jpg,/home/atuin/g103ea/shared/coco2014/images/COCO_val2014_000000149571.jpg,/home/atuin/g103ea/shared/concept_pair_switched/surfboard_skateboard_20240705_235141.png,323951,149571,False,0.003,0.0012656250000000003,200,199,2.0,100.0,0.07,9.390625,9.203125,0.97216796875,9.1328125,1.0166015625,0.09923163056373596,3.8752358477722737e-07,1.030669927597046,surfboard,skateboard,A man walking on the beach with a surfboard.,A young man riding a skateboard down a street.,A young man riding a skateboard down a street.
/home/atuin/g103ea/shared/coco2014/images/COCO_val2014_000000142697.jpg,/home/atuin/g103ea/shared/coco2014/images/COCO_val2014_000000490381.jpg,/home/atuin/g103ea/shared/concept_pair_switched/surfboard_skateboard_20240705_235146.png,142697,490381,False,0.003,0.0009492187500000002,200,200,2.0,100.0,0.07,9.3671875,9.3671875,0.310791015625,9.3515625,0.4677734375,0.07000017166137695,1.9251302774137002e-09,0.310791552066803,surfboard,skateboard,A man riding a wave on top of a surfboard.,A woman is holding a skateboard and a man is walking behind her.,A woman is holding a skateboard and a man is holding a skateboard.
/home/atuin/g103ea/shared/coco2014/images/COCO_val2014_000000046736.jpg,/home/atuin/g103ea/shared/coco2014/images/COCO_val2014_000000394892.jpg,/home/atuin/g103ea/shared/concept_pair_switched/surfboard_skateboard_20240705_235153.png,46736,394892,False,0.003,0.0012656250000000003,200,200,2.0,100.0,0.07,8.4296875,8.390625,0.394775390625,8.3515625,0.472900390625,0.07497978210449219,2.6027692001662217e-07,0.4047609865665436,surfboard,skateboard,A surfer riding a wave in the ocean.,A boy is doing a trick on a skateboard.,A boy is doing a trick on a skateboard.
/home/atuin/g103ea/shared/coco2014/images/COCO_val2014_000000021924.jpg,/home/atuin/g103ea/shared/coco2014/images/COCO_val2014_000000495687.jpg,/home/atuin/g103ea/shared/concept_pair_switched/surfboard_skateboard_20240705_235158.png,21924,495687,False,0.003,0.0012656250000000003,200,200,2.0,100.0,0.07,10.515625,10.4375,0.6474609375,10.40625,0.75390625,0.07895908504724503,9.031366232647997e-08,0.6653881669044495,surfboard,skateboard,Two women standing on a beach holding surfboards.,A man riding a skateboard down a set of steps.,A person riding a skateboard down a set of steps.
/home/atuin/g103ea/shared/coco2014/images/COCO_val2014_000000559270.jpg,/home/atuin/g103ea/shared/coco2014/images/COCO_val2014_000000282346.jpg,/home/atuin/g103ea/shared/concept_pair_switched/surfboard_skateboard_20240705_235205.png,559270,282346,False,0.003,0.0012656250000000003,200,200,2.0,100.0,0.07,10.359375,10.28125,0.50048828125,10.25,0.5927734375,0.08774258941411972,1.5483080062494992e-07,0.5359889268875122,surfboard,skateboard,A vintage green car with two women inside.,A person on a skateboard on a ramp.,A person on a skateboard on a sidewalk.
/home/atuin/g103ea/shared/coco2014/images/COCO_val2014_000000503765.jpg,/home/atuin/g103ea/shared/coco2014/images/COCO_val2014_000000540556.jpg,/home/atuin/g103ea/shared/concept_pair_switched/surfboard_skateboard_20240705_235211.png,503765,540556,False,0.003,0.0012656250000000003,200,196,2.0,100.0,0.07,10.4765625,10.4375,0.353271484375,10.4453125,0.486083984375,0.07007183879613876,3.160125174872519e-07,0.35344675183296204,surfboard,skateboard,An orange and green car with a surfboard on top.,A man riding a skateboard up the side of a ramp.,A man riding a skateboard up the side of a ramp.
/home/atuin/g103ea/shared/coco2014/images/COCO_val2014_000000005476.jpg,/home/atuin/g103ea/shared/coco2014/images/COCO_val2014_000000118965.jpg,/home/atuin/g103ea/shared/concept_pair_switched/surfboard_skateboard_20240705_235218.png,5476,118965,False,0.003,0.0009492187500000002,200,200,2.0,100.0,0.07,10.828125,10.7734375,0.349365234375,10.75,0.378173828125,0.07403968274593353,4.616313997729549e-09,0.35744503140449524,surfboard,skateboard,A group of people walking along a beach.,A young man sitting on a skateboard in a field.,A young man sitting on a skateboard in a field.
/home/atuin/g103ea/shared/coco2014/images/COCO_val2014_000000070744.jpg,/home/atuin/g103ea/shared/coco2014/images/COCO_val2014_000000552824.jpg,/home/atuin/g103ea/shared/concept_pair_switched/surfboard_skateboard_20240705_235225.png,70744,552824,False,0.003,0.0016875000000000002,200,196,2.0,100.0,0.07,8.9765625,8.9375,0.390625,8.875,0.436767578125,0.06921699643135071,2.4045810675943358e-08,0.3906274139881134,surfboard,skateboard,A group of people sitting around a table with surfboards.,A car is parked in front of a garage door.,A car is parked in front of a garage door.
/home/atuin/g103ea/shared/coco2014/images/COCO_val2014_000000430302.jpg,/home/atuin/g103ea/shared/coco2014/images/COCO_val2014_000000279278.jpg,/home/atuin/g103ea/shared/concept_pair_switched/surfboard_skateboard_20240705_235232.png,430302,279278,False,0.003,0.0016875000000000002,200,200,2.0,100.0,0.07,9.8828125,9.8359375,0.37548828125,9.828125,0.4013671875,0.06976564228534698,3.987734942256793e-07,0.37552815675735474,surfboard,skateboard,A man and woman riding on top of a surfboard.,A woman riding a skateboard down a street.,A woman riding a skateboard down a street.
/home/atuin/g103ea/shared/coco2014/images/COCO_val2014_000000544583.jpg,/home/atuin/g103ea/shared/coco2014/images/COCO_val2014_000000119964.jpg,/home/atuin/g103ea/shared/concept_pair_switched/surfboard_skateboard_20240705_235238.png,544583,119964,False,0.003,0.0012656250000000003,200,197,2.0,100.0,0.07,9.828125,9.7890625,0.55322265625,9.7890625,0.58056640625,0.0727403312921524,1.178565778303664e-08,0.5587044954299927,surfboard,skateboard,A man riding a wave on top of a surfboard.,A person sitting on a field next to a skateboard.,A person sitting on a skateboard in a field.
/home/atuin/g103ea/shared/coco2014/images/COCO_val2014_000000534122.jpg,/home/atuin/g103ea/shared/coco2014/images/COCO_val2014_000000325343.jpg,/home/atuin/g103ea/shared/concept_pair_switched/surfboard_skateboard_20240705_235244.png,534122,325343,False,0.003,0.0009492187500000002,200,200,2.0,100.0,0.07,10.2265625,10.1796875,0.281005859375,10.1015625,0.343017578125,0.08973655104637146,9.393983191330335e-08,0.3204883635044098,surfboard,skateboard,A man riding a wave on top of a surfboard.,A young man riding a skateboard down a cement ramp.,A young man riding a skateboard down a cement ramp.
/home/atuin/g103ea/shared/coco2014/images/COCO_val2014_000000272153.jpg,/home/atuin/g103ea/shared/coco2014/images/COCO_val2014_000000215151.jpg,/home/atuin/g103ea/shared/concept_pair_switched/surfboard_skateboard_20240705_235251.png,272153,215151,False,0.003,0.0009492187500000002,200,196,2.0,100.0,0.07,10.6953125,10.6953125,0.3134765625,10.6796875,0.388427734375,0.09417695552110672,1.1353940898573e-08,0.3618316054344177,surfboard,skateboard,A man and a dog walking on a beach.,A man riding a skateboard down a metal rail.,A man riding a skateboard down a metal rail.
/home/atuin/g103ea/shared/coco2014/images/COCO_val2014_000000050493.jpg,/home/atuin/g103ea/shared/coco2014/images/COCO_val2014_000000318543.jpg,/home/atuin/g103ea/shared/concept_pair_switched/surfboard_skateboard_20240705_235257.png,50493,318543,False,0.003,0.0012656250000000003,200,195,2.0,100.0,0.07,10.0546875,10.03125,0.232421875,10.0234375,0.262451171875,0.070102758705616,4.07657463341593e-09,0.23262779414653778,surfboard,skateboard,A couple of people walking on top of a beach.,A boy is doing a trick on a skateboard.,A boy doing a trick on a skateboard on a bench.
/home/atuin/g103ea/shared/coco2014/images/COCO_val2014_000000216096.jpg,/home/atuin/g103ea/shared/coco2014/images/COCO_val2014_000000559730.jpg,/home/atuin/g103ea/shared/concept_pair_switched/surfboard_skateboard_20240705_235302.png,216096,559730,False,0.003,0.0012656250000000003,200,200,2.0,100.0,0.07,8.8203125,8.765625,0.611328125,8.7578125,0.6416015625,0.07000873982906342,1.8339051166549325e-08,0.6113474369049072,surfboard,skateboard,A group of people riding surfboards on top of a wave.,A man riding a skateboard across a street.,A man riding a skateboard across a street.
/home/atuin/g103ea/shared/coco2014/images/COCO_val2014_000000005476.jpg,/home/atuin/g103ea/shared/coco2014/images/COCO_val2014_000000571012.jpg,/home/atuin/g103ea/shared/concept_pair_switched/surfboard_skateboard_20240705_235309.png,5476,571012,False,0.003,0.0012656250000000003,200,197,2.0,100.0,0.07,11.6484375,11.609375,0.392822265625,11.6171875,0.4775390625,0.07008568197488785,2.8144185648670828e-08,0.3929964303970337,surfboard,skateboard,A group of people walking along a beach.,A woman standing on a skateboard in an office.,A woman standing on a skateboard in an office.
/home/atuin/g103ea/shared/coco2014/images/COCO_val2014_000000216096.jpg,/home/atuin/g103ea/shared/coco2014/images/COCO_val2014_000000422677.jpg,/home/atuin/g103ea/shared/concept_pair_switched/surfboard_skateboard_20240705_235315.png,216096,422677,False,0.003,0.0012656250000000003,200,200,2.0,100.0,0.07,9.5859375,9.515625,0.51953125,9.5,0.60693359375,0.06994021683931351,0.0,0.51953125,surfboard,skateboard,A group of people riding surfboards on top of a wave.,A young man riding a skateboard down a sidewalk.,A man riding a skateboard down a sidewalk.
/home/atuin/g103ea/shared/coco2014/images/COCO_val2014_000000050493.jpg,/home/atuin/g103ea/shared/coco2014/images/COCO_val2014_000000016285.jpg,/home/atuin/g103ea/shared/concept_pair_switched/surfboard_skateboard_20240705_235322.png,50493,16285,False,0.003,0.0012656250000000003,200,198,2.0,100.0,0.07,10.9921875,10.9609375,0.4482421875,10.9765625,0.467041015625,0.0701385959982872,3.2663795224152636e-08,0.4485226571559906,surfboard,skateboard,A couple of people walking on top of a beach.,A woman riding a skateboard down a street.,A woman riding a skateboard down a street.
/home/atuin/g103ea/shared/coco2014/images/COCO_val2014_000000050493.jpg,/home/atuin/g103ea/shared/coco2014/images/COCO_val2014_000000122217.jpg,/home/atuin/g103ea/shared/concept_pair_switched/surfboard_skateboard_20240705_235328.png,50493,122217,False,0.003,0.0009492187500000002,200,199,2.0,100.0,0.07,9.8046875,9.7421875,0.34130859375,9.765625,0.4755859375,0.06999635696411133,7.631697940269078e-09,0.3413093686103821,surfboard,skateboard,A couple of people walking on top of a beach.,Two people skateboarding down a road with a bridge in the background.,Two people skateboarding down a road with a green ramp.
/home/atuin/g103ea/shared/coco2014/images/COCO_val2014_000000021924.jpg,/home/atuin/g103ea/shared/coco2014/images/COCO_val2014_000000103413.jpg,/home/atuin/g103ea/shared/concept_pair_switched/surfboard_skateboard_20240705_235334.png,21924,103413,False,0.003,0.0009492187500000002,200,199,2.0,100.0,0.07,9.3828125,9.359375,0.210693359375,9.34375,0.25830078125,0.07002847641706467,1.9667750095209158e-08,0.21075227856636047,surfboard,skateboard,Two women standing on a beach holding surfboards.,A man riding a skateboard down the side of a ramp.,A man riding a skateboard down the side of a ramp.
/home/atuin/g103ea/shared/coco2014/images/COCO_val2014_000000170852.jpg,/home/atuin/g103ea/shared/coco2014/images/COCO_val2014_000000122217.jpg,/home/atuin/g103ea/shared/concept_pair_switched/surfboard_skateboard_20240705_235340.png,170852,122217,False,0.003,0.0009492187500000002,200,200,2.0,100.0,0.07,7.4921875,7.4609375,0.270263671875,7.515625,0.4462890625,0.07403362542390823,3.149602578744748e-09,0.2783312499523163,surfboard,skateboard,A man riding a wave on top of a surfboard.,Two people skateboarding down a road with a green ramp.,Two people skateboarding down a road with a green ramp.
/home/atuin/g103ea/shared/coco2014/images/COCO_val2014_000000021924.jpg,/home/atuin/g103ea/shared/coco2014/images/COCO_val2014_000000288528.jpg,/home/atuin/g103ea/shared/concept_pair_switched/surfboard_skateboard_20240705_235345.png,21924,288528,False,0.003,0.0012656250000000003,200,200,2.0,100.0,0.07,9.21875,9.1953125,0.39208984375,9.1875,0.436279296875,0.07025471329689026,7.581262195799354e-08,0.39260685443878174,surfboard,skateboard,Two women standing on a beach holding surfboards.,A group of children riding skateboards on top of a cement ramp.,A group of children riding skateboards on top of a cement ramp.
/home/atuin/g103ea/shared/coco2014/images/COCO_val2014_000000517973.jpg,/home/atuin/g103ea/shared/coco2014/images/COCO_val2014_000000293802.jpg,/home/atuin/g103ea/shared/concept_pair_switched/surfboard_skateboard_20240705_235351.png,517973,293802,False,0.003,0.0012656250000000003,200,198,2.0,100.0,0.07,10.515625,10.46875,0.425537109375,10.4453125,0.50341796875,0.0902152806520462,8.88493190132067e-08,0.4659765362739563,surfboard,skateboard,A small car with a surfboard on top of it.,A man doing a trick on a skateboard on a sidewalk.,A man doing a trick on a skateboard on a sidewalk.
/home/atuin/g103ea/shared/coco2014/images/COCO_val2014_000000503765.jpg,/home/atuin/g103ea/shared/coco2014/images/COCO_val2014_000000149571.jpg,/home/atuin/g103ea/shared/concept_pair_switched/surfboard_skateboard_20240705_235357.png,503765,149571,False,0.003,0.0016875000000000002,200,199,2.0,100.0,0.07,11.171875,11.015625,0.9638671875,10.9609375,1.0234375,0.07548768073320389,1.2591900713232462e-06,0.9749684929847717,surfboard,skateboard,An orange and green car with a surfboard on top.,A man riding a skateboard down a street.,A young man riding a skateboard down a street.
/home/atuin/g103ea/shared/coco2014/images/COCO_val2014_000000489339.jpg,/home/atuin/g103ea/shared/coco2014/images/COCO_val2014_000000288528.jpg,/home/atuin/g103ea/shared/concept_pair_switched/surfboard_skateboard_20240705_235403.png,489339,288528,False,0.003,0.0009492187500000002,200,199,2.0,100.0,0.07,8.84375,8.796875,0.5615234375,8.8203125,0.59716796875,0.09982079267501831,1.6112622347463912e-07,0.6211811304092407,surfboard,skateboard,A woman in a wet suit carrying a surfboard.,A group of children standing on top of skateboards.,A group of children riding skateboards on top of a cement ramp.
/home/atuin/g103ea/shared/coco2014/images/COCO_val2014_000000409581.jpg,/home/atuin/g103ea/shared/coco2014/images/COCO_val2014_000000481573.jpg,/home/atuin/g103ea/shared/concept_pair_switched/surfboard_skateboard_20240705_235409.png,409581,481573,False,0.003,0.0016875000000000002,200,198,2.0,100.0,0.07,9.2890625,9.1953125,0.489990234375,9.2265625,0.6904296875,0.0699569508433342,7.388492235804733e-07,0.4900641143321991,surfboard,skateboard,A man carrying a surfboard on a beach.,A young man standing on a skateboard in front of a building.,A young man standing on a skateboard in front of a building.
/home/atuin/g103ea/shared/coco2014/images/COCO_val2014_000000021924.jpg,/home/atuin/g103ea/shared/coco2014/images/COCO_val2014_000000525227.jpg,/home/atuin/g103ea/shared/concept_pair_switched/surfboard_skateboard_20240705_235415.png,21924,525227,False,0.003,0.0016875000000000002,200,198,2.0,100.0,0.07,9.953125,9.9296875,0.416015625,9.90625,0.491943359375,0.07898471504449844,5.386330670376083e-08,0.4339904487133026,surfboard,skateboard,Two women standing on a beach holding surfboards.,A young man riding a skateboard in a garage.,A man riding a skateboard in a room.
/home/atuin/g103ea/shared/coco2014/images/COCO_val2014_000000216096.jpg,/home/atuin/g103ea/shared/coco2014/images/COCO_val2014_000000062839.jpg,/home/atuin/g103ea/shared/concept_pair_switched/surfboard_skateboard_20240705_235420.png,216096,62839,False,0.003,0.0012656250000000003,200,198,2.0,100.0,0.07,10.5078125,10.421875,0.52294921875,10.4375,0.56640625,0.06998533755540848,2.4444034352200106e-08,0.5229516625404358,surfboard,skateboard,A group of people riding surfboards on top of a wave.,A person is standing in a parking garage.,A person standing in a parking garage next to a van.
/home/atuin/g103ea/shared/coco2014/images/COCO_val2014_000000005476.jpg,/home/atuin/g103ea/shared/coco2014/images/COCO_val2014_000000495252.jpg,/home/atuin/g103ea/shared/concept_pair_switched/surfboard_skateboard_20240705_235426.png,5476,495252,False,0.003,0.0012656250000000003,200,194,2.0,100.0,0.07,10.625,10.5859375,0.35888671875,10.59375,0.37353515625,0.07000415772199631,1.232074708923392e-07,0.3589073419570923,surfboard,skateboard,A group of people walking along a beach.,A man riding a skateboard down a street.,A man riding a skateboard down a street.
/home/atuin/g103ea/shared/coco2014/images/COCO_val2014_000000216096.jpg,/home/atuin/g103ea/shared/coco2014/images/COCO_val2014_000000288528.jpg,/home/atuin/g103ea/shared/concept_pair_switched/surfboard_skateboard_20240705_235432.png,216096,288528,False,0.003,0.0012656250000000003,200,198,2.0,100.0,0.07,8.515625,8.4921875,0.26806640625,8.5234375,0.299560546875,0.0700998529791832,1.8468426787876524e-10,0.26826614141464233,surfboard,skateboard,A group of people riding surfboards on top of a wave.,A group of children riding skateboards on top of a cement ramp.,A group of children riding skateboards on top of a cement ramp.
/home/atuin/g103ea/shared/coco2014/images/COCO_val2014_000000117584.jpg,/home/atuin/g103ea/shared/coco2014/images/COCO_val2014_000000288528.jpg,/home/atuin/g103ea/shared/concept_pair_switched/surfboard_skateboard_20240705_235438.png,117584,288528,False,0.003,0.0012656250000000003,200,200,2.0,100.0,0.07,8.1953125,8.1875,0.2484130859375,8.1875,0.314697265625,0.06998937577009201,2.709355584329387e-08,0.24841579794883728,surfboard,skateboard,A woman riding a wave on top of a surfboard.,A group of children riding skateboards on top of a cement ramp.,A group of children riding skateboards on top of a cement ramp.
/home/atuin/g103ea/shared/coco2014/images/COCO_val2014_000000005476.jpg,/home/atuin/g103ea/shared/coco2014/images/COCO_val2014_000000067252.jpg,/home/atuin/g103ea/shared/concept_pair_switched/surfboard_skateboard_20240705_235445.png,5476,67252,False,0.003,0.0012656250000000003,200,199,2.0,100.0,0.07,10.796875,10.7734375,0.2347412109375,10.796875,0.312744140625,0.07011852413415909,2.8400620744051253e-10,0.23497828841209412,surfboard,skateboard,A group of people walking along a beach.,A man riding a skateboard down the side of a cement ramp.,A man riding a skateboard down the side of a cement ramp.
/home/atuin/g103ea/shared/coco2014/images/COCO_val2014_000000005476.jpg,/home/atuin/g103ea/shared/coco2014/images/COCO_val2014_000000288528.jpg,/home/atuin/g103ea/shared/concept_pair_switched/surfboard_skateboard_20240705_235451.png,5476,288528,False,0.003,0.0005339355468750001,200,200,2.0,100.0,0.07,8.4375,8.4296875,0.1842041015625,8.421875,0.2607421875,0.0699511468410492,1.4052820018761736e-09,0.18420423567295074,surfboard,skateboard,A group of people walking along a beach.,A group of children riding skateboards on top of a cement ramp.,A group of children riding skateboards on top of a cement ramp.
/home/atuin/g103ea/shared/coco2014/images/COCO_val2014_000000521994.jpg,/home/atuin/g103ea/shared/coco2014/images/COCO_val2014_000000067252.jpg,/home/atuin/g103ea/shared/concept_pair_switched/surfboard_skateboard_20240705_235457.png,521994,67252,False,0.003,0.0012656250000000003,200,199,2.0,100.0,0.07,10.078125,10.078125,0.261474609375,10.0703125,0.32177734375,0.06998354941606522,4.2882206230387965e-08,0.26147890090942383,surfboard,skateboard,A young boy standing on a beach holding a surfboard.,A man riding a skateboard down the side of a cement ramp.,A man riding a skateboard down the side of a cement ramp.
/home/atuin/g103ea/shared/coco2014/images/COCO_val2014_000000292648.jpg,/home/atuin/g103ea/shared/coco2014/images/COCO_val2014_000000540556.jpg,/home/atuin/g103ea/shared/concept_pair_switched/surfboard_skateboard_20240705_235503.png,292648,540556,False,0.003,0.0012656250000000003,200,200,2.0,100.0,0.07,8.5546875,8.515625,0.260009765625,8.53125,0.43017578125,0.07003186643123627,1.0992953036748077e-07,0.26008448004722595,surfboard,skateboard,A man holding a surfboard on a pier.,A man riding a skateboard up the side of a ramp.,A man riding a skateboard up the side of a ramp.
/home/atuin/g103ea/shared/coco2014/images/COCO_val2014_000000152111.jpg,/home/atuin/g103ea/shared/coco2014/images/COCO_val2014_000000414379.jpg,/home/atuin/g103ea/shared/concept_pair_switched/surfboard_skateboard_20240705_235509.png,152111,414379,False,0.003,0.0012656250000000003,200,196,2.0,100.0,0.07,10.1171875,10.0078125,0.6533203125,9.9921875,0.7001953125,0.0700172483921051,1.1452341297513158e-08,0.6533559560775757,surfboard,skateboard,A person is windsurfing on a large body of water.,A group of people on motorcycles waiting at a cross walk.,A group of people on motorcycles waiting at a stop light.
/home/atuin/g103ea/shared/coco2014/images/COCO_val2014_000000005476.jpg,/home/atuin/g103ea/shared/coco2014/images/COCO_val2014_000000495252.jpg,/home/atuin/g103ea/shared/concept_pair_switched/surfboard_skateboard_20240705_235515.png,5476,495252,False,0.003,0.0012656250000000003,200,199,2.0,100.0,0.07,10.625,10.578125,0.36181640625,10.6015625,0.402099609375,0.06998974829912186,1.267273006533287e-07,0.36182907223701477,surfboard,skateboard,A group of people walking along a beach.,A man riding a skateboard down a street.,A man riding a skateboard down a street.
/home/atuin/g103ea/shared/coco2014/images/COCO_val2014_000000005476.jpg,/home/atuin/g103ea/shared/coco2014/images/COCO_val2014_000000540556.jpg,/home/atuin/g103ea/shared/concept_pair_switched/surfboard_skateboard_20240705_235522.png,5476,540556,False,0.003,0.0009492187500000002,200,200,2.0,100.0,0.07,10.640625,10.6328125,0.17236328125,10.6328125,0.384521484375,0.06997711956501007,5.067966046823358e-09,0.1723637878894806,surfboard,skateboard,A group of people walking along a beach.,A man riding a skateboard up the side of a ramp.,A man riding a skateboard up the side of a ramp.
/home/atuin/g103ea/shared/coco2014/images/COCO_val2014_000000005476.jpg,/home/atuin/g103ea/shared/coco2014/images/COCO_val2014_000000243825.jpg,/home/atuin/g103ea/shared/concept_pair_switched/surfboard_skateboard_20240705_235528.png,5476,243825,False,0.003,0.0009492187500000002,200,199,2.0,100.0,0.07,9.9375,9.890625,0.333251953125,9.890625,0.4345703125,0.07002224028110504,5.716563888924497e-10,0.3332964777946472,surfboard,skateboard,A group of people walking along a beach.,A woman riding a bike down a street at night.,A woman riding a bike down a street at night.
